"Date","EFFR","OBFR","TGCR","BGCR","SOFR","Percentile01_EFFR","Percentile01_OBFR","Percentile01_TGCR","Percentile01_BGCR","Percentile01_SOFR","Percentile25_EFFR","Percentile25_OBFR","Percentile25_TGCR","Percentile25_BGCR","Percentile25_SOFR","Percentile75_EFFR","Percentile75_OBFR","Percentile75_TGCR","Percentile75_BGCR","Percentile75_SOFR","Percentile99_EFFR","Percentile99_OBFR","Percentile99_TGCR","Percentile99_BGCR","Percentile99_SOFR","TargetDe","TargetUe","VolumeEFFR","VolumeOBFR","VolumeTGCR","VolumeBGCR","VolumeSOFR","RRPONTSYAWARD","IORR","sdate"
"3/4/2016",36,37,0,0,0,34,25,0,0,0,36,36,0,0,0,37,37,0,0,0,52,43,0,0,0,25,50,75,325,0,0,0,25,50,2016-03-04
"3/7/2016",36,37,0,0,0,34,15,0,0,0,36,36,0,0,0,37,37,0,0,0,50,43,0,0,0,25,50,72,320,0,0,0,25,50,2016-03-07
"3/8/2016",36,37,0,0,0,32,25,0,0,0,36,36,0,0,0,37,37,0,0,0,50,42,0,0,0,25,50,72,327,0,0,0,25,50,2016-03-08
"3/9/2016",36,37,0,0,0,34,25,0,0,0,36,36,0,0,0,37,37,0,0,0,52,43,0,0,0,25,50,75,322,0,0,0,25,50,2016-03-09
"3/10/2016",36,37,0,0,0,35,25,0,0,0,36,36,0,0,0,37,37,0,0,0,75,43,0,0,0,25,50,72,331,0,0,0,25,50,2016-03-10
"3/11/2016",36,37,0,0,0,35,25,0,0,0,36,36,0,0,0,37,37,0,0,0,50,43,0,0,0,25,50,68,314,0,0,0,25,50,2016-03-11
"3/14/2016",36,37,0,0,0,35,25,0,0,0,36,36,0,0,0,37,37,0,0,0,50,43,0,0,0,25,50,67,304,0,0,0,25,50,2016-03-14
"3/15/2016",37,37,0,0,0,35,29,0,0,0,36,36,0,0,0,37,37,0,0,0,50,42,0,0,0,25,50,67,302,0,0,0,25,50,2016-03-15
"3/16/2016",37,37,0,0,0,35,28,0,0,0,36,36,0,0,0,37,37,0,0,0,50,42,0,0,0,25,50,63,299,0,0,0,25,50,2016-03-16
"3/17/2016",37,37,0,0,0,36,15,0,0,0,36,36,0,0,0,37,37,0,0,0,50,42,0,0,0,25,50,63,306,0,0,0,25,50,2016-03-17
"3/18/2016",37,37,0,0,0,32,15,0,0,0,36,36,0,0,0,37,37,0,0,0,55,43,0,0,0,25,50,66,299,0,0,0,25,50,2016-03-18
"3/21/2016",37,37,0,0,0,35,15,0,0,0,36,36,0,0,0,37,37,0,0,0,56,43,0,0,0,25,50,61,305,0,0,0,25,50,2016-03-21
"3/22/2016",37,37,0,0,0,33,25,0,0,0,36,37,0,0,0,37,37,0,0,0,55,43,0,0,0,25,50,66,310,0,0,0,25,50,2016-03-22
"3/23/2016",37,37,0,0,0,32,25,0,0,0,36,37,0,0,0,37,37,0,0,0,55,43,0,0,0,25,50,65,295,0,0,0,25,50,2016-03-23
"3/24/2016",37,37,0,0,0,35,24,0,0,0,36,36,0,0,0,37,38,0,0,0,56,55,0,0,0,25,50,64,94,0,0,0,0,50,2016-03-24
"3/25/2016",37,37,0,0,0,30,1,0,0,0,36,36,0,0,0,37,37,0,0,0,56,55,0,0,0,25,50,68,96,0,0,0,0,50,2016-03-25
"3/28/2016",37,37,0,0,0,35,25,0,0,0,36,37,0,0,0,37,37,0,0,0,56,44,0,0,0,25,50,66,297,0,0,0,25,50,2016-03-28
"3/29/2016",37,37,0,0,0,30,25,0,0,0,36,37,0,0,0,37,37,0,0,0,55,43,0,0,0,25,50,69,295,0,0,0,25,50,2016-03-29
"3/30/2016",37,37,0,0,0,35,25,0,0,0,36,37,0,0,0,37,37,0,0,0,56,48,0,0,0,25,50,73,301,0,0,0,25,50,2016-03-30
"3/31/2016",25,25,0,0,0,20,15,0,0,0,25,25,0,0,0,26,27,0,0,0,56,55,0,0,0,25,50,50,181,0,0,0,25,50,2016-03-31
"4/1/2016",37,37,0,0,0,34,25,0,0,0,36,37,0,0,0,37,37,0,0,0,55,44,0,0,0,25,50,72,292,0,0,0,25,50,2016-04-01
"4/4/2016",37,37,0,0,0,35,28,0,0,0,36,37,0,0,0,37,37,0,0,0,55,43,0,0,0,25,50,74,294,0,0,0,25,50,2016-04-04
"4/5/2016",37,37,0,0,0,35,28,0,0,0,36,37,0,0,0,37,37,0,0,0,55,43,0,0,0,25,50,77,291,0,0,0,25,50,2016-04-05
"4/6/2016",37,37,0,0,0,35,25,0,0,0,36,37,0,0,0,37,37,0,0,0,55,44,0,0,0,25,50,76,292,0,0,0,25,50,2016-04-06
"4/7/2016",37,37,0,0,0,35,29,0,0,0,36,37,0,0,0,37,37,0,0,0,53,44,0,0,0,25,50,79,294,0,0,0,25,50,2016-04-07
"4/8/2016",37,37,0,0,0,33,27,0,0,0,36,37,0,0,0,37,37,0,0,0,53,43,0,0,0,25,50,74,293,0,0,0,25,50,2016-04-08
"4/11/2016",37,37,0,0,0,35,29,0,0,0,36,37,0,0,0,37,37,0,0,0,50,43,0,0,0,25,50,72,298,0,0,0,25,50,2016-04-11
"4/12/2016",37,37,0,0,0,35,29,0,0,0,36,37,0,0,0,37,37,0,0,0,50,43,0,0,0,25,50,74,300,0,0,0,25,50,2016-04-12
"4/13/2016",37,37,0,0,0,33,15,0,0,0,36,37,0,0,0,37,37,0,0,0,53,43,0,0,0,25,50,73,289,0,0,0,25,50,2016-04-13
"4/14/2016",37,37,0,0,0,35,29,0,0,0,37,37,0,0,0,37,37,0,0,0,56,43,0,0,0,25,50,71,278,0,0,0,25,50,2016-04-14
"4/15/2016",37,37,0,0,0,36,20,0,0,0,37,37,0,0,0,38,37,0,0,0,50,43,0,0,0,25,50,70,277,0,0,0,25,50,2016-04-15
"4/18/2016",37,37,0,0,0,36,29,0,0,0,37,37,0,0,0,37,37,0,0,0,56,44,0,0,0,25,50,69,283,0,0,0,25,50,2016-04-18
"4/19/2016",37,37,0,0,0,36,29,0,0,0,37,37,0,0,0,37,37,0,0,0,56,45,0,0,0,25,50,66,290,0,0,0,25,50,2016-04-19
"4/20/2016",37,37,0,0,0,33,28,0,0,0,37,37,0,0,0,37,37,0,0,0,56,45,0,0,0,25,50,62,282,0,0,0,25,50,2016-04-20
"4/21/2016",37,37,0,0,0,36,25,0,0,0,37,37,0,0,0,37,37,0,0,0,56,44,0,0,0,25,50,65,299,0,0,0,25,50,2016-04-21
"4/22/2016",37,37,0,0,0,36,5,0,0,0,37,37,0,0,0,37,37,0,0,0,56,44,0,0,0,25,50,59,289,0,0,0,25,50,2016-04-22
"4/25/2016",37,37,0,0,0,36,25,0,0,0,37,37,0,0,0,37,37,0,0,0,56,46,0,0,0,25,50,59,279,0,0,0,25,50,2016-04-25
"4/26/2016",37,37,0,0,0,35,25,0,0,0,37,37,0,0,0,37,37,0,0,0,56,46,0,0,0,25,50,54,273,0,0,0,25,50,2016-04-26
"4/27/2016",37,37,0,0,0,36,28,0,0,0,37,37,0,0,0,37,37,0,0,0,56,44,0,0,0,25,50,63,294,0,0,0,25,50,2016-04-27
"4/28/2016",37,37,0,0,0,36,29,0,0,0,37,37,0,0,0,38,37,0,0,0,56,46,0,0,0,25,50,62,302,0,0,0,25,50,2016-04-28
"4/29/2016",30,30,0,0,0,27,27,0,0,0,29,29,0,0,0,30,30,0,0,0,56,44,0,0,0,25,50,58,290,0,0,0,25,50,2016-04-29
"5/2/2016",37,37,0,0,0,33,28,0,0,0,37,37,0,0,0,37,37,0,0,0,56,44,0,0,0,25,50,59,280,0,0,0,25,50,2016-05-02
"5/3/2016",37,37,0,0,0,36,29,0,0,0,37,37,0,0,0,38,37,0,0,0,56,47,0,0,0,25,50,61,296,0,0,0,25,50,2016-05-03
"5/4/2016",37,37,0,0,0,36,28,0,0,0,37,37,0,0,0,38,37,0,0,0,56,44,0,0,0,25,50,62,267,0,0,0,25,50,2016-05-04
"5/5/2016",37,37,0,0,0,36,29,0,0,0,37,37,0,0,0,38,37,0,0,0,56,44,0,0,0,25,50,60,292,0,0,0,25,50,2016-05-05
"5/6/2016",37,37,0,0,0,36,29,0,0,0,37,37,0,0,0,38,37,0,0,0,56,44,0,0,0,25,50,64,294,0,0,0,25,50,2016-05-06
"5/9/2016",37,37,0,0,0,35,29,0,0,0,37,37,0,0,0,38,37,0,0,0,56,44,0,0,0,25,50,62,296,0,0,0,25,50,2016-05-09
"5/10/2016",37,37,0,0,0,36,29,0,0,0,37,37,0,0,0,38,38,0,0,0,53,43,0,0,0,25,50,63,292,0,0,0,25,50,2016-05-10
"5/11/2016",37,37,0,0,0,36,29,0,0,0,37,37,0,0,0,38,38,0,0,0,55,43,0,0,0,25,50,63,287,0,0,0,25,50,2016-05-11
"5/12/2016",37,37,0,0,0,36,29,0,0,0,37,37,0,0,0,38,38,0,0,0,55,44,0,0,0,25,50,61,292,0,0,0,25,50,2016-05-12
"5/13/2016",37,37,0,0,0,36,29,0,0,0,37,37,0,0,0,38,38,0,0,0,56,44,0,0,0,25,50,61,268,0,0,0,25,50,2016-05-13
"5/16/2016",37,37,0,0,0,36,29,0,0,0,37,37,0,0,0,38,38,0,0,0,56,44,0,0,0,25,50,61,290,0,0,0,25,50,2016-05-16
"5/17/2016",37,37,0,0,0,36,25,0,0,0,37,37,0,0,0,38,38,0,0,0,56,44,0,0,0,25,50,62,293,0,0,0,25,50,2016-05-17
"5/18/2016",37,37,0,0,0,36,15,0,0,0,37,37,0,0,0,38,38,0,0,0,55,43,0,0,0,25,50,59,301,0,0,0,25,50,2016-05-18
"5/19/2016",37,37,0,0,0,34,30,0,0,0,37,37,0,0,0,38,38,0,0,0,56,44,0,0,0,25,50,64,309,0,0,0,25,50,2016-05-19
"5/20/2016",37,37,0,0,0,36,29,0,0,0,37,37,0,0,0,38,38,0,0,0,56,44,0,0,0,25,50,70,309,0,0,0,25,50,2016-05-20
"5/23/2016",37,37,0,0,0,36,31,0,0,0,37,37,0,0,0,38,38,0,0,0,56,44,0,0,0,25,50,66,313,0,0,0,25,50,2016-05-23
"5/24/2016",37,37,0,0,0,36,20,0,0,0,37,37,0,0,0,38,38,0,0,0,56,44,0,0,0,25,50,65,321,0,0,0,25,50,2016-05-24
"5/25/2016",37,37,0,0,0,35,29,0,0,0,37,37,0,0,0,38,38,0,0,0,50,43,0,0,0,25,50,70,307,0,0,0,25,50,2016-05-25
"5/26/2016",37,37,0,0,0,36,30,0,0,0,37,37,0,0,0,38,38,0,0,0,56,43,0,0,0,25,50,68,318,0,0,0,25,50,2016-05-26
"5/27/2016",37,37,0,0,0,36,29,0,0,0,37,37,0,0,0,38,38,0,0,0,56,45,0,0,0,25,50,69,308,0,0,0,25,50,2016-05-27
"5/31/2016",29,29,0,0,0,26,26,0,0,0,28,28,0,0,0,30,30,0,0,0,56,45,0,0,0,25,50,58,284,0,0,0,25,50,2016-05-31
"6/1/2016",37,37,0,0,0,36,29,0,0,0,37,37,0,0,0,38,38,0,0,0,53,45,0,0,0,25,50,67,305,0,0,0,25,50,2016-06-01
"6/2/2016",37,37,0,0,0,36,29,0,0,0,37,37,0,0,0,38,38,0,0,0,53,45,0,0,0,25,50,70,302,0,0,0,25,50,2016-06-02
"6/3/2016",37,37,0,0,0,35,28,0,0,0,37,37,0,0,0,38,38,0,0,0,50,45,0,0,0,25,50,69,295,0,0,0,25,50,2016-06-03
"6/6/2016",37,37,0,0,0,36,29,0,0,0,37,37,0,0,0,38,38,0,0,0,54,45,0,0,0,25,50,70,291,0,0,0,25,50,2016-06-06
"6/7/2016",37,37,0,0,0,36,29,0,0,0,37,37,0,0,0,38,38,0,0,0,55,46,0,0,0,25,50,71,296,0,0,0,25,50,2016-06-07
"6/8/2016",37,37,0,0,0,36,30,0,0,0,37,37,0,0,0,38,38,0,0,0,54,45,0,0,0,25,50,75,293,0,0,0,25,50,2016-06-08
"6/9/2016",37,37,0,0,0,31,30,0,0,0,37,37,0,0,0,38,38,0,0,0,54,45,0,0,0,25,50,75,293,0,0,0,25,50,2016-06-09
"6/10/2016",37,37,0,0,0,36,30,0,0,0,37,37,0,0,0,38,38,0,0,0,52,45,0,0,0,25,50,72,284,0,0,0,25,50,2016-06-10
"6/13/2016",37,37,0,0,0,36,30,0,0,0,37,37,0,0,0,38,38,0,0,0,54,45,0,0,0,25,50,66,285,0,0,0,25,50,2016-06-13
"6/14/2016",37,37,0,0,0,36,29,0,0,0,37,37,0,0,0,38,38,0,0,0,55,46,0,0,0,25,50,68,257,0,0,0,25,50,2016-06-14
"6/15/2016",37,38,0,0,0,36,28,0,0,0,37,37,0,0,0,38,38,0,0,0,56,45,0,0,0,25,50,69,241,0,0,0,25,50,2016-06-15
"6/16/2016",38,38,0,0,0,36,28,0,0,0,37,38,0,0,0,38,38,0,0,0,56,48,0,0,0,25,50,72,255,0,0,0,25,50,2016-06-16
"6/17/2016",38,38,0,0,0,36,28,0,0,0,38,38,0,0,0,38,38,0,0,0,53,46,0,0,0,25,50,73,247,0,0,0,25,50,2016-06-17
"6/20/2016",38,38,0,0,0,36,27,0,0,0,38,38,0,0,0,39,38,0,0,0,56,47,0,0,0,25,50,70,248,0,0,0,25,50,2016-06-20
"6/21/2016",38,38,0,0,0,37,27,0,0,0,38,38,0,0,0,39,39,0,0,0,56,45,0,0,0,25,50,68,258,0,0,0,25,50,2016-06-21
"6/22/2016",38,38,0,0,0,36,27,0,0,0,38,38,0,0,0,39,39,0,0,0,56,47,0,0,0,25,50,71,250,0,0,0,25,50,2016-06-22
"6/23/2016",39,39,0,0,0,37,27,0,0,0,39,39,0,0,0,39,40,0,0,0,56,47,0,0,0,25,50,71,244,0,0,0,25,50,2016-06-23
"6/24/2016",40,40,0,0,0,38,5,0,0,0,40,40,0,0,0,42,42,0,0,0,56,47,0,0,0,25,50,70,248,0,0,0,25,50,2016-06-24
"6/27/2016",41,41,0,0,0,38,27,0,0,0,40,40,0,0,0,42,42,0,0,0,56,47,0,0,0,25,50,66,239,0,0,0,25,50,2016-06-27
"6/28/2016",41,41,0,0,0,39,28,0,0,0,40,40,0,0,0,42,42,0,0,0,56,47,0,0,0,25,50,66,242,0,0,0,25,50,2016-06-28
"6/29/2016",41,41,0,0,0,39,25,0,0,0,40,40,0,0,0,42,42,0,0,0,56,47,0,0,0,25,50,63,249,0,0,0,25,50,2016-06-29
"6/30/2016",30,30,0,0,0,25,20,0,0,0,29,30,0,0,0,32,32,0,0,0,56,47,0,0,0,25,50,46,159,0,0,0,25,50,2016-06-30
"7/1/2016",41,41,0,0,0,30,25,0,0,0,40,40,0,0,0,41,41,0,0,0,56,46,0,0,0,25,50,68,235,0,0,0,25,50,2016-07-01
"7/5/2016",40,40,0,0,0,38,30,0,0,0,40,40,0,0,0,41,41,0,0,0,75,47,0,0,0,25,50,72,273,0,0,0,25,50,2016-07-05
"7/6/2016",40,40,0,0,0,37,25,0,0,0,40,40,0,0,0,41,41,0,0,0,55,45,0,0,0,25,50,68,231,0,0,0,25,50,2016-07-06
"7/7/2016",40,40,0,0,0,37,27,0,0,0,40,40,0,0,0,41,41,0,0,0,56,46,0,0,0,25,50,68,245,0,0,0,25,50,2016-07-07
"7/8/2016",40,40,0,0,0,37,25,0,0,0,40,40,0,0,0,41,41,0,0,0,55,45,0,0,0,25,50,67,244,0,0,0,25,50,2016-07-08
"7/11/2016",40,40,0,0,0,38,27,0,0,0,40,40,0,0,0,41,41,0,0,0,56,46,0,0,0,25,50,65,254,0,0,0,25,50,2016-07-11
"7/12/2016",40,40,0,0,0,36,27,0,0,0,40,40,0,0,0,41,41,0,0,0,56,46,0,0,0,25,50,63,258,0,0,0,25,50,2016-07-12
"7/13/2016",40,40,0,0,0,38,27,0,0,0,40,40,0,0,0,41,41,0,0,0,51,45,0,0,0,25,50,64,264,0,0,0,25,50,2016-07-13
"7/14/2016",40,40,0,0,0,34,27,0,0,0,40,40,0,0,0,41,41,0,0,0,56,46,0,0,0,25,50,62,250,0,0,0,25,50,2016-07-14
"7/15/2016",40,40,0,0,0,33,27,0,0,0,40,40,0,0,0,41,41,0,0,0,50,45,0,0,0,25,50,71,256,0,0,0,25,50,2016-07-15
"7/18/2016",40,40,0,0,0,35,28,0,0,0,40,40,0,0,0,41,41,0,0,0,55,46,0,0,0,25,50,65,248,0,0,0,25,50,2016-07-18
"7/19/2016",40,40,0,0,0,34,30,0,0,0,40,40,0,0,0,41,41,0,0,0,50,46,0,0,0,25,50,74,255,0,0,0,25,50,2016-07-19
"7/20/2016",40,40,0,0,0,38,30,0,0,0,40,40,0,0,0,41,41,0,0,0,50,46,0,0,0,25,50,70,254,0,0,0,25,50,2016-07-20
"7/21/2016",40,40,0,0,0,35,28,0,0,0,40,40,0,0,0,41,41,0,0,0,56,48,0,0,0,25,50,72,254,0,0,0,25,50,2016-07-21
"7/22/2016",40,40,0,0,0,35,5,0,0,0,40,40,0,0,0,41,41,0,0,0,55,48,0,0,0,25,50,72,249,0,0,0,25,50,2016-07-22
"7/25/2016",40,40,0,0,0,35,25,0,0,0,40,40,0,0,0,41,41,0,0,0,56,48,0,0,0,25,50,70,267,0,0,0,25,50,2016-07-25
"7/26/2016",40,40,0,0,0,35,27,0,0,0,40,40,0,0,0,41,41,0,0,0,56,48,0,0,0,25,50,69,268,0,0,0,25,50,2016-07-26
"7/27/2016",40,40,0,0,0,33,27,0,0,0,40,40,0,0,0,41,41,0,0,0,56,48,0,0,0,25,50,64,254,0,0,0,25,50,2016-07-27
"7/28/2016",40,40,0,0,0,27,27,0,0,0,40,40,0,0,0,41,41,0,0,0,56,48,0,0,0,25,50,63,254,0,0,0,25,50,2016-07-28
"7/29/2016",30,30,0,0,0,20,20,0,0,0,30,30,0,0,0,31,31,0,0,0,56,52,0,0,0,25,50,62,252,0,0,0,25,50,2016-07-29
"8/1/2016",40,40,0,0,0,31,27,0,0,0,40,40,0,0,0,41,41,0,0,0,53,48,0,0,0,25,50,69,247,0,0,0,25,50,2016-08-01
"8/2/2016",40,40,0,0,0,32,27,0,0,0,40,40,0,0,0,41,41,0,0,0,50,46,0,0,0,25,50,63,258,0,0,0,25,50,2016-08-02
"8/3/2016",40,40,0,0,0,31,27,0,0,0,40,40,0,0,0,41,41,0,0,0,50,48,0,0,0,25,50,69,266,0,0,0,25,50,2016-08-03
"8/4/2016",40,40,0,0,0,27,27,0,0,0,40,40,0,0,0,41,41,0,0,0,50,48,0,0,0,25,50,70,264,0,0,0,25,50,2016-08-04
"8/5/2016",40,40,0,0,0,38,27,0,0,0,40,40,0,0,0,41,41,0,0,0,51,48,0,0,0,25,50,66,257,0,0,0,25,50,2016-08-05
"8/8/2016",40,40,0,0,0,36,27,0,0,0,40,40,0,0,0,41,41,0,0,0,53,48,0,0,0,25,50,67,259,0,0,0,25,50,2016-08-08
"8/9/2016",40,40,0,0,0,27,27,0,0,0,40,40,0,0,0,41,41,0,0,0,50,48,0,0,0,25,50,67,252,0,0,0,25,50,2016-08-09
"8/10/2016",40,40,0,0,0,30,27,0,0,0,40,40,0,0,0,41,41,0,0,0,50,46,0,0,0,25,50,61,246,0,0,0,25,50,2016-08-10
"8/11/2016",40,40,0,0,0,31,27,0,0,0,40,40,0,0,0,41,41,0,0,0,50,48,0,0,0,25,50,64,237,0,0,0,25,50,2016-08-11
"8/12/2016",40,40,0,0,0,30,27,0,0,0,40,40,0,0,0,41,41,0,0,0,50,45,0,0,0,25,50,63,241,0,0,0,25,50,2016-08-12
"8/15/2016",40,40,0,0,0,30,27,0,0,0,40,40,0,0,0,41,41,0,0,0,50,46,0,0,0,25,50,67,243,0,0,0,25,50,2016-08-15
"8/16/2016",40,40,0,0,0,27,27,0,0,0,40,40,0,0,0,41,41,0,0,0,50,48,0,0,0,25,50,64,243,0,0,0,25,50,2016-08-16
"8/17/2016",40,40,0,0,0,30,27,0,0,0,40,40,0,0,0,41,41,0,0,0,50,46,0,0,0,25,50,64,250,0,0,0,25,50,2016-08-17
"8/18/2016",40,40,0,0,0,30,27,0,0,0,40,40,0,0,0,41,41,0,0,0,50,47,0,0,0,25,50,64,239,0,0,0,25,50,2016-08-18
"8/19/2016",40,40,0,0,0,30,25,0,0,0,40,40,0,0,0,41,41,0,0,0,53,48,0,0,0,25,50,61,245,0,0,0,25,50,2016-08-19
"8/22/2016",40,40,0,0,0,36,27,0,0,0,40,40,0,0,0,41,41,0,0,0,56,48,0,0,0,25,50,60,248,0,0,0,25,50,2016-08-22
"8/23/2016",40,40,0,0,0,36,27,0,0,0,40,40,0,0,0,41,41,0,0,0,53,48,0,0,0,25,50,69,254,0,0,0,25,50,2016-08-23
"8/24/2016",40,40,0,0,0,31,19,0,0,0,40,40,0,0,0,41,41,0,0,0,55,48,0,0,0,25,50,64,251,0,0,0,25,50,2016-08-24
"8/25/2016",40,40,0,0,0,27,27,0,0,0,40,40,0,0,0,41,41,0,0,0,55,48,0,0,0,25,50,67,257,0,0,0,25,50,2016-08-25
"8/26/2016",40,40,0,0,0,27,27,0,0,0,40,40,0,0,0,41,41,0,0,0,50,49,0,0,0,25,50,74,254,0,0,0,25,50,2016-08-26
"8/29/2016",40,40,0,0,0,27,27,0,0,0,40,40,0,0,0,41,41,0,0,0,53,49,0,0,0,25,50,70,258,0,0,0,25,50,2016-08-29
"8/30/2016",40,40,0,0,0,27,27,0,0,0,40,40,0,0,0,41,41,0,0,0,55,49,0,0,0,25,50,67,250,0,0,0,25,50,2016-08-30
"8/31/2016",30,30,0,0,0,19,25,0,0,0,30,30,0,0,0,31,31,0,0,0,50,49,0,0,0,25,50,64,244,0,0,0,25,50,2016-08-31
"9/1/2016",40,40,0,0,0,31,27,0,0,0,40,40,0,0,0,41,41,0,0,0,50,49,0,0,0,25,50,63,227,0,0,0,25,50,2016-09-01
"9/2/2016",40,40,0,0,0,31,27,0,0,0,40,40,0,0,0,41,41,0,0,0,50,49,0,0,0,25,50,68,224,0,0,0,25,50,2016-09-02
"9/6/2016",40,40,0,0,0,31,30,0,0,0,40,40,0,0,0,41,41,0,0,0,50,49,0,0,0,25,50,65,233,0,0,0,25,50,2016-09-06
"9/7/2016",40,40,0,0,0,31,28,0,0,0,40,40,0,0,0,41,41,0,0,0,55,49,0,0,0,25,50,66,244,0,0,0,25,50,2016-09-07
"9/8/2016",40,40,0,0,0,31,27,0,0,0,40,40,0,0,0,41,41,0,0,0,50,49,0,0,0,25,50,68,248,0,0,0,25,50,2016-09-08
"9/9/2016",40,40,0,0,0,27,27,0,0,0,40,40,0,0,0,41,41,0,0,0,50,47,0,0,0,25,50,65,228,0,0,0,25,50,2016-09-09
"9/12/2016",40,40,0,0,0,31,30,0,0,0,40,40,0,0,0,41,41,0,0,0,55,49,0,0,0,25,50,63,243,0,0,0,25,50,2016-09-12
"9/13/2016",40,40,0,0,0,36,27,0,0,0,40,40,0,0,0,41,41,0,0,0,50,49,0,0,0,25,50,60,229,0,0,0,25,50,2016-09-13
"9/14/2016",40,40,0,0,0,36,30,0,0,0,40,40,0,0,0,41,41,0,0,0,50,49,0,0,0,25,50,59,224,0,0,0,25,50,2016-09-14
"9/15/2016",40,40,0,0,0,30,26,0,0,0,40,40,0,0,0,41,41,0,0,0,55,49,0,0,0,25,50,63,233,0,0,0,25,50,2016-09-15
"9/16/2016",40,40,0,0,0,36,25,0,0,0,40,40,0,0,0,41,41,0,0,0,50,49,0,0,0,25,50,60,231,0,0,0,25,50,2016-09-16
"9/19/2016",40,40,0,0,0,36,27,0,0,0,40,40,0,0,0,41,41,0,0,0,53,49,0,0,0,25,50,59,230,0,0,0,25,50,2016-09-19
"9/20/2016",40,40,0,0,0,36,25,0,0,0,40,40,0,0,0,41,41,0,0,0,53,49,0,0,0,25,50,57,232,0,0,0,25,50,2016-09-20
"9/21/2016",40,40,0,0,0,36,30,0,0,0,40,40,0,0,0,41,41,0,0,0,50,49,0,0,0,25,50,61,221,0,0,0,25,50,2016-09-21
"9/22/2016",40,40,0,0,0,36,27,0,0,0,40,40,0,0,0,41,41,0,0,0,53,49,0,0,0,25,50,62,226,0,0,0,25,50,2016-09-22
"9/23/2016",40,40,0,0,0,36,5,0,0,0,40,40,0,0,0,41,41,0,0,0,50,49,0,0,0,25,50,61,222,0,0,0,25,50,2016-09-23
"9/26/2016",40,40,0,0,0,36,25,0,0,0,40,40,0,0,0,41,41,0,0,0,50,49,0,0,0,25,50,63,213,0,0,0,25,50,2016-09-26
"9/27/2016",40,40,0,0,0,35,25,0,0,0,40,40,0,0,0,41,41,0,0,0,50,49,0,0,0,25,50,64,186,0,0,0,25,50,2016-09-27
"9/28/2016",40,40,0,0,0,26,25,0,0,0,40,40,0,0,0,41,41,0,0,0,50,50,0,0,0,25,50,70,205,0,0,0,25,50,2016-09-28
"9/29/2016",40,40,0,0,0,36,25,0,0,0,40,40,0,0,0,41,41,0,0,0,50,49,0,0,0,25,50,67,197,0,0,0,25,50,2016-09-29
"9/30/2016",29,29,0,0,0,26,25,0,0,0,28,28,0,0,0,30,30,0,0,0,50,50,0,0,0,25,50,58,142,0,0,0,25,50,2016-09-30
"10/3/2016",40,40,0,0,0,26,25,0,0,0,40,40,0,0,0,41,41,0,0,0,50,49,0,0,0,25,50,66,193,0,0,0,25,50,2016-10-03
"10/4/2016",40,40,0,0,0,26,26,0,0,0,40,40,0,0,0,41,41,0,0,0,50,49,0,0,0,25,50,61,188,0,0,0,25,50,2016-10-04
"10/5/2016",40,40,0,0,0,26,26,0,0,0,40,40,0,0,0,41,41,0,0,0,50,49,0,0,0,25,50,63,176,0,0,0,25,50,2016-10-05
"10/6/2016",40,40,0,0,0,26,28,0,0,0,40,40,0,0,0,41,41,0,0,0,50,50,0,0,0,25,50,65,177,0,0,0,25,50,2016-10-06
"10/7/2016",40,41,0,0,0,26,26,0,0,0,40,40,0,0,0,41,41,0,0,0,50,50,0,0,0,25,50,66,176,0,0,0,25,50,2016-10-07
"10/11/2016",41,41,0,0,0,30,26,0,0,0,40,40,0,0,0,41,41,0,0,0,55,50,0,0,0,25,50,63,169,0,0,0,25,50,2016-10-11
"10/12/2016",41,41,0,0,0,26,26,0,0,0,40,40,0,0,0,41,41,0,0,0,50,50,0,0,0,25,50,70,178,0,0,0,25,50,2016-10-12
"10/13/2016",41,41,0,0,0,26,25,0,0,0,40,40,0,0,0,41,41,0,0,0,50,50,0,0,0,25,50,67,168,0,0,0,25,50,2016-10-13
"10/14/2016",41,41,0,0,0,36,30,0,0,0,40,40,0,0,0,41,41,0,0,0,50,50,0,0,0,25,50,66,163,0,0,0,25,50,2016-10-14
"10/17/2016",41,41,0,0,0,26,26,0,0,0,40,40,0,0,0,41,41,0,0,0,50,50,0,0,0,25,50,62,163,0,0,0,25,50,2016-10-17
"10/18/2016",41,41,0,0,0,26,26,0,0,0,40,40,0,0,0,41,41,0,0,0,50,50,0,0,0,25,50,67,168,0,0,0,25,50,2016-10-18
"10/19/2016",41,41,0,0,0,26,26,0,0,0,40,40,0,0,0,41,41,0,0,0,50,50,0,0,0,25,50,66,170,0,0,0,25,50,2016-10-19
"10/20/2016",41,41,0,0,0,26,26,0,0,0,40,40,0,0,0,41,41,0,0,0,50,50,0,0,0,25,50,70,176,0,0,0,25,50,2016-10-20
"10/21/2016",41,41,0,0,0,26,26,0,0,0,40,40,0,0,0,41,41,0,0,0,55,50,0,0,0,25,50,70,181,0,0,0,25,50,2016-10-21
"10/24/2016",41,41,0,0,0,26,5,0,0,0,40,40,0,0,0,41,41,0,0,0,55,50,0,0,0,25,50,65,177,0,0,0,25,50,2016-10-24
"10/25/2016",41,41,0,0,0,34,28,0,0,0,40,40,0,0,0,41,41,0,0,0,50,50,0,0,0,25,50,73,179,0,0,0,25,50,2016-10-25
"10/26/2016",41,41,0,0,0,26,26,0,0,0,40,40,0,0,0,41,41,0,0,0,50,50,0,0,0,25,50,66,163,0,0,0,25,50,2016-10-26
"10/27/2016",41,41,0,0,0,26,25,0,0,0,40,40,0,0,0,41,41,0,0,0,50,50,0,0,0,25,50,65,158,0,0,0,25,50,2016-10-27
"10/28/2016",41,41,0,0,0,30,28,0,0,0,40,40,0,0,0,41,41,0,0,0,50,50,0,0,0,25,50,67,163,0,0,0,25,50,2016-10-28
"10/31/2016",31,31,0,0,0,25,25,0,0,0,30,30,0,0,0,32,32,0,0,0,50,50,0,0,0,25,50,61,147,0,0,0,25,50,2016-10-31
"11/1/2016",41,41,0,0,0,30,30,0,0,0,40,40,0,0,0,41,41,0,0,0,50,50,0,0,0,25,50,63,157,0,0,0,25,50,2016-11-01
"11/2/2016",41,41,0,0,0,30,30,0,0,0,40,40,0,0,0,41,41,0,0,0,50,50,0,0,0,25,50,67,161,0,0,0,25,50,2016-11-02
"11/3/2016",41,41,0,0,0,36,28,0,0,0,40,40,0,0,0,41,41,0,0,0,50,50,0,0,0,25,50,63,159,0,0,0,25,50,2016-11-03
"11/4/2016",41,41,0,0,0,30,25,0,0,0,40,40,0,0,0,41,41,0,0,0,50,50,0,0,0,25,50,65,157,0,0,0,25,50,2016-11-04
"11/7/2016",41,41,0,0,0,36,30,0,0,0,40,40,0,0,0,41,41,0,0,0,50,50,0,0,0,25,50,62,166,0,0,0,25,50,2016-11-07
"11/8/2016",41,41,0,0,0,36,30,0,0,0,40,40,0,0,0,41,41,0,0,0,50,50,0,0,0,25,50,61,162,0,0,0,25,50,2016-11-08
"11/9/2016",41,41,0,0,0,30,26,0,0,0,40,40,0,0,0,41,41,0,0,0,50,50,0,0,0,25,50,65,172,0,0,0,25,50,2016-11-09
"11/10/2016",41,41,0,0,0,36,26,0,0,0,40,40,0,0,0,41,41,0,0,0,50,50,0,0,0,25,50,64,141,0,0,0,25,50,2016-11-10
"11/14/2016",41,41,0,0,0,36,28,0,0,0,40,40,0,0,0,41,41,0,0,0,50,50,0,0,0,25,50,59,167,0,0,0,25,50,2016-11-14
"11/15/2016",41,41,0,0,0,31,30,0,0,0,41,40,0,0,0,41,41,0,0,0,50,49,0,0,0,25,50,66,174,0,0,0,25,50,2016-11-15
"11/16/2016",41,41,0,0,0,36,30,0,0,0,41,41,0,0,0,41,42,0,0,0,50,49,0,0,0,25,50,70,180,0,0,0,25,50,2016-11-16
"11/17/2016",41,41,0,0,0,32,30,0,0,0,41,40,0,0,0,41,41,0,0,0,50,50,0,0,0,25,50,73,172,0,0,0,25,50,2016-11-17
"11/18/2016",41,41,0,0,0,30,30,0,0,0,41,41,0,0,0,41,41,0,0,0,52,50,0,0,0,25,50,72,178,0,0,0,25,50,2016-11-18
"11/21/2016",41,41,0,0,0,36,30,0,0,0,41,41,0,0,0,41,41,0,0,0,56,50,0,0,0,25,50,76,185,0,0,0,25,50,2016-11-21
"11/22/2016",41,41,0,0,0,30,30,0,0,0,41,41,0,0,0,41,41,0,0,0,53,50,0,0,0,25,50,77,177,0,0,0,25,50,2016-11-22
"11/23/2016",41,41,0,0,0,30,5,0,0,0,41,41,0,0,0,41,41,0,0,0,50,55,0,0,0,25,50,78,184,0,0,0,25,50,2016-11-23
"11/25/2016",41,41,0,0,0,30,25,0,0,0,41,41,0,0,0,41,41,0,0,0,50,50,0,0,0,25,50,76,182,0,0,0,25,50,2016-11-25
"11/28/2016",41,41,0,0,0,36,30,0,0,0,41,41,0,0,0,41,42,0,0,0,53,50,0,0,0,25,50,69,178,0,0,0,25,50,2016-11-28
"11/29/2016",41,41,0,0,0,30,30,0,0,0,41,41,0,0,0,41,41,0,0,0,50,50,0,0,0,25,50,75,181,0,0,0,25,50,2016-11-29
"11/30/2016",31,31,0,0,0,28,28,0,0,0,31,31,0,0,0,32,32,0,0,0,55,50,0,0,0,25,50,68,166,0,0,0,25,50,2016-11-30
"12/1/2016",41,41,0,0,0,25,25,0,0,0,41,41,0,0,0,41,41,0,0,0,50,50,0,0,0,25,50,81,173,0,0,0,25,50,2016-12-01
"12/2/2016",41,41,0,0,0,25,25,0,0,0,41,41,0,0,0,41,41,0,0,0,49,50,0,0,0,25,50,81,179,0,0,0,25,50,2016-12-02
"12/5/2016",41,41,0,0,0,30,30,0,0,0,41,41,0,0,0,41,41,0,0,0,50,50,0,0,0,25,50,77,185,0,0,0,25,50,2016-12-05
"12/6/2016",41,41,0,0,0,30,30,0,0,0,41,41,0,0,0,41,41,0,0,0,50,50,0,0,0,25,50,75,183,0,0,0,25,50,2016-12-06
"12/7/2016",41,41,0,0,0,30,30,0,0,0,41,41,0,0,0,41,41,0,0,0,50,50,0,0,0,25,50,76,181,0,0,0,25,50,2016-12-07
"12/8/2016",41,41,0,0,0,30,30,0,0,0,41,41,0,0,0,41,41,0,0,0,50,52,0,0,0,25,50,75,173,0,0,0,25,50,2016-12-08
"12/9/2016",41,41,0,0,0,30,30,0,0,0,41,41,0,0,0,41,41,0,0,0,50,50,0,0,0,25,50,68,171,0,0,0,25,50,2016-12-09
"12/12/2016",41,41,0,0,0,30,30,0,0,0,41,41,0,0,0,41,42,0,0,0,53,50,0,0,0,25,50,71,181,0,0,0,25,50,2016-12-12
"12/13/2016",41,41,0,0,0,34,30,0,0,0,41,41,0,0,0,41,42,0,0,0,50,50,0,0,0,25,50,73,176,0,0,0,25,50,2016-12-13
"12/14/2016",41,41,0,0,0,30,30,0,0,0,41,41,0,0,0,41,42,0,0,0,50,50,0,0,0,25,50,78,187,0,0,0,25,50,2016-12-14
"12/15/2016",66,66,0,0,0,41,41,0,0,0,66,66,0,0,0,66,66,0,0,0,75,75,0,0,0,50,75,74,170,0,0,0,50,75,2016-12-15
"12/16/2016",66,66,0,0,0,59,50,0,0,0,66,66,0,0,0,66,66,0,0,0,75,75,0,0,0,50,75,72,184,0,0,0,50,75,2016-12-16
"12/19/2016",66,66,0,0,0,60,50,0,0,0,66,66,0,0,0,66,67,0,0,0,80,75,0,0,0,50,75,69,171,0,0,0,50,75,2016-12-19
"12/20/2016",66,66,0,0,0,63,50,0,0,0,66,66,0,0,0,66,67,0,0,0,75,75,0,0,0,50,75,70,175,0,0,0,50,75,2016-12-20
"12/21/2016",66,66,0,0,0,63,50,0,0,0,66,66,0,0,0,66,67,0,0,0,78,75,0,0,0,50,75,73,169,0,0,0,50,75,2016-12-21
"12/22/2016",66,66,0,0,0,53,50,0,0,0,66,66,0,0,0,66,67,0,0,0,80,75,0,0,0,50,75,73,173,0,0,0,50,75,2016-12-22
"12/23/2016",66,66,0,0,0,63,15,0,0,0,66,66,0,0,0,66,67,0,0,0,80,75,0,0,0,50,75,73,167,0,0,0,50,75,2016-12-23
"12/27/2016",66,66,0,0,0,50,50,0,0,0,66,66,0,0,0,66,67,0,0,0,80,77,0,0,0,50,75,74,173,0,0,0,50,75,2016-12-27
"12/28/2016",66,66,0,0,0,54,50,0,0,0,66,66,0,0,0,67,67,0,0,0,81,77,0,0,0,50,75,74,172,0,0,0,50,75,2016-12-28
"12/29/2016",66,66,0,0,0,50,50,0,0,0,66,66,0,0,0,66,67,0,0,0,80,77,0,0,0,50,75,73,167,0,0,0,50,75,2016-12-29
"12/30/2016",55,55,0,0,0,50,45,0,0,0,52,52,0,0,0,55,55,0,0,0,82,130,0,0,0,50,75,48,122,0,0,0,50,75,2016-12-30
"1/3/2017",66,66,0,0,0,50,50,0,0,0,66,66,0,0,0,66,67,0,0,0,80,77,0,0,0,50,75,80,167,0,0,0,50,75,2017-01-03
"1/4/2017",66,66,0,0,0,50,50,0,0,0,66,66,0,0,0,66,67,0,0,0,75,77,0,0,0,50,75,79,188,0,0,0,50,75,2017-01-04
"1/5/2017",66,66,0,0,0,50,50,0,0,0,66,66,0,0,0,66,67,0,0,0,78,77,0,0,0,50,75,77,181,0,0,0,50,75,2017-01-05
"1/6/2017",66,66,0,0,0,50,50,0,0,0,66,66,0,0,0,66,67,0,0,0,80,77,0,0,0,50,75,79,191,0,0,0,50,75,2017-01-06
"1/9/2017",66,66,0,0,0,50,50,0,0,0,66,66,0,0,0,67,67,0,0,0,75,77,0,0,0,50,75,74,188,0,0,0,50,75,2017-01-09
"1/10/2017",66,66,0,0,0,50,50,0,0,0,66,66,0,0,0,67,67,0,0,0,80,77,0,0,0,50,75,77,197,0,0,0,50,75,2017-01-10
"1/11/2017",66,66,0,0,0,63,50,0,0,0,66,66,0,0,0,67,67,0,0,0,75,77,0,0,0,50,75,80,195,0,0,0,50,75,2017-01-11
"1/12/2017",66,66,0,0,0,50,50,0,0,0,66,66,0,0,0,67,67,0,0,0,75,77,0,0,0,50,75,84,200,0,0,0,50,75,2017-01-12
"1/13/2017",66,66,0,0,0,64,45,0,0,0,66,66,0,0,0,67,67,0,0,0,75,77,0,0,0,50,75,74,179,0,0,0,50,75,2017-01-13
"1/17/2017",66,66,0,0,0,64,50,0,0,0,66,66,0,0,0,68,67,0,0,0,80,77,0,0,0,50,75,68,183,0,0,0,50,75,2017-01-17
"1/18/2017",66,66,0,0,0,64,50,0,0,0,66,66,0,0,0,67,67,0,0,0,75,77,0,0,0,50,75,69,177,0,0,0,50,75,2017-01-18
"1/19/2017",66,66,0,0,0,63,45,0,0,0,66,66,0,0,0,68,67,0,0,0,80,77,0,0,0,50,75,68,177,0,0,0,50,75,2017-01-19
"1/20/2017",66,66,0,0,0,64,50,0,0,0,66,66,0,0,0,68,67,0,0,0,78,77,0,0,0,50,75,70,176,0,0,0,50,75,2017-01-20
"1/23/2017",66,66,0,0,0,64,50,0,0,0,66,66,0,0,0,68,68,0,0,0,81,77,0,0,0,50,75,64,185,0,0,0,50,75,2017-01-23
"1/24/2017",66,66,0,0,0,64,15,0,0,0,66,66,0,0,0,67,67,0,0,0,80,77,0,0,0,50,75,66,189,0,0,0,50,75,2017-01-24
"1/25/2017",66,66,0,0,0,64,50,0,0,0,66,66,0,0,0,68,67,0,0,0,78,77,0,0,0,50,75,72,194,0,0,0,50,75,2017-01-25
"1/26/2017",66,66,0,0,0,64,50,0,0,0,66,66,0,0,0,67,67,0,0,0,78,77,0,0,0,50,75,80,199,0,0,0,50,75,2017-01-26
"1/27/2017",66,66,0,0,0,64,45,0,0,0,66,66,0,0,0,67,67,0,0,0,78,77,0,0,0,50,75,77,194,0,0,0,50,75,2017-01-27
"1/30/2017",66,66,0,0,0,65,50,0,0,0,66,66,0,0,0,67,67,0,0,0,80,77,0,0,0,50,75,71,197,0,0,0,50,75,2017-01-30
"1/31/2017",56,56,0,0,0,55,50,0,0,0,56,56,0,0,0,57,58,0,0,0,80,77,0,0,0,50,75,74,201,0,0,0,50,75,2017-01-31
"2/1/2017",66,66,0,0,0,62,50,0,0,0,66,66,0,0,0,67,67,0,0,0,80,77,0,0,0,50,75,80,198,0,0,0,50,75,2017-02-01
"2/2/2017",66,66,0,0,0,63,53,0,0,0,66,66,0,0,0,67,67,0,0,0,80,77,0,0,0,50,75,82,202,0,0,0,50,75,2017-02-02
"2/3/2017",66,66,0,0,0,62,53,0,0,0,66,66,0,0,0,67,67,0,0,0,80,77,0,0,0,50,75,82,201,0,0,0,50,75,2017-02-03
"2/6/2017",66,66,0,0,0,62,53,0,0,0,66,66,0,0,0,67,67,0,0,0,80,77,0,0,0,50,75,82,215,0,0,0,50,75,2017-02-06
"2/7/2017",66,66,0,0,0,60,50,0,0,0,66,66,0,0,0,67,67,0,0,0,80,77,0,0,0,50,75,75,205,0,0,0,50,75,2017-02-07
"2/8/2017",66,66,0,0,0,64,53,0,0,0,66,66,0,0,0,67,67,0,0,0,80,77,0,0,0,50,75,80,210,0,0,0,50,75,2017-02-08
"2/9/2017",66,66,0,0,0,64,53,0,0,0,66,66,0,0,0,67,67,0,0,0,80,77,0,0,0,50,75,76,204,0,0,0,50,75,2017-02-09
"2/10/2017",66,66,0,0,0,64,50,0,0,0,66,66,0,0,0,67,67,0,0,0,80,77,0,0,0,50,75,78,216,0,0,0,50,75,2017-02-10
"2/13/2017",66,66,0,0,0,60,50,0,0,0,66,66,0,0,0,67,67,0,0,0,80,77,0,0,0,50,75,75,207,0,0,0,50,75,2017-02-13
"2/14/2017",66,66,0,0,0,64,50,0,0,0,66,66,0,0,0,67,67,0,0,0,80,77,0,0,0,50,75,73,204,0,0,0,50,75,2017-02-14
"2/15/2017",66,66,0,0,0,60,53,0,0,0,66,66,0,0,0,67,67,0,0,0,80,77,0,0,0,50,75,79,210,0,0,0,50,75,2017-02-15
"2/16/2017",66,66,0,0,0,63,52,0,0,0,66,66,0,0,0,67,67,0,0,0,80,77,0,0,0,50,75,81,220,0,0,0,50,75,2017-02-16
"2/17/2017",66,66,0,0,0,64,53,0,0,0,66,66,0,0,0,67,67,0,0,0,80,77,0,0,0,50,75,82,221,0,0,0,50,75,2017-02-17
"2/21/2017",66,66,0,0,0,60,53,0,0,0,66,66,0,0,0,67,67,0,0,0,80,77,0,0,0,50,75,74,215,0,0,0,50,75,2017-02-21
"2/22/2017",66,66,0,0,0,55,53,0,0,0,66,66,0,0,0,67,68,0,0,0,80,77,0,0,0,50,75,81,223,0,0,0,50,75,2017-02-22
"2/23/2017",66,66,0,0,0,55,53,0,0,0,66,66,0,0,0,67,67,0,0,0,80,77,0,0,0,50,75,88,227,0,0,0,50,75,2017-02-23
"2/24/2017",66,66,0,0,0,55,15,0,0,0,66,66,0,0,0,67,67,0,0,0,80,77,0,0,0,50,75,87,224,0,0,0,50,75,2017-02-24
"2/27/2017",66,66,0,0,0,60,50,0,0,0,66,66,0,0,0,67,67,0,0,0,78,77,0,0,0,50,75,85,226,0,0,0,50,75,2017-02-27
"2/28/2017",57,57,0,0,0,55,50,0,0,0,56,56,0,0,0,57,57,0,0,0,78,77,0,0,0,50,75,86,202,0,0,0,50,75,2017-02-28
"3/1/2017",66,66,0,0,0,60,53,0,0,0,66,66,0,0,0,67,67,0,0,0,75,77,0,0,0,50,75,84,210,0,0,0,50,75,2017-03-01
"3/2/2017",66,66,0,0,0,53,50,0,0,0,66,66,0,0,0,67,67,0,0,0,78,77,0,0,0,50,75,85,221,0,0,0,50,75,2017-03-02
"3/3/2017",66,66,0,0,0,60,50,0,0,0,66,66,0,0,0,67,67,0,0,0,75,77,0,0,0,50,75,88,211,0,0,0,50,75,2017-03-03
"3/6/2017",66,66,0,0,0,60,50,0,0,0,66,66,0,0,0,67,67,0,0,0,80,77,0,0,0,50,75,83,210,0,0,0,50,75,2017-03-06
"3/7/2017",66,66,0,0,0,62,53,0,0,0,66,66,0,0,0,67,67,0,0,0,75,77,0,0,0,50,75,83,205,0,0,0,50,75,2017-03-07
"3/8/2017",66,66,0,0,0,64,54,0,0,0,66,66,0,0,0,67,67,0,0,0,80,77,0,0,0,50,75,84,207,0,0,0,50,75,2017-03-08
"3/9/2017",66,66,0,0,0,64,55,0,0,0,66,66,0,0,0,67,67,0,0,0,80,77,0,0,0,50,75,86,207,0,0,0,50,75,2017-03-09
"3/10/2017",66,66,0,0,0,58,50,0,0,0,66,66,0,0,0,67,67,0,0,0,78,77,0,0,0,50,75,84,206,0,0,0,50,75,2017-03-10
"3/13/2017",66,66,0,0,0,55,50,0,0,0,66,66,0,0,0,67,67,0,0,0,75,77,0,0,0,50,75,83,205,0,0,0,50,75,2017-03-13
"3/14/2017",66,66,0,0,0,60,53,0,0,0,66,66,0,0,0,67,67,0,0,0,75,77,0,0,0,50,75,79,195,0,0,0,50,75,2017-03-14
"3/15/2017",66,66,0,0,0,55,50,0,0,0,66,66,0,0,0,67,67,0,0,0,80,77,0,0,0,50,75,88,221,0,0,0,50,75,2017-03-15
"3/16/2017",91,91,0,0,0,80,75,0,0,0,91,91,0,0,0,91,91,0,0,0,103,102,0,0,0,75,100,85,209,0,0,0,75,100,2017-03-16
"3/17/2017",91,91,0,0,0,80,75,0,0,0,91,91,0,0,0,91,92,0,0,0,103,102,0,0,0,75,100,83,209,0,0,0,75,100,2017-03-17
"3/20/2017",91,91,0,0,0,89,75,0,0,0,91,91,0,0,0,91,92,0,0,0,105,102,0,0,0,75,100,80,202,0,0,0,75,100,2017-03-20
"3/21/2017",91,91,0,0,0,80,75,0,0,0,91,91,0,0,0,91,92,0,0,0,103,102,0,0,0,75,100,83,208,0,0,0,75,100,2017-03-21
"3/22/2017",91,91,0,0,0,80,70,0,0,0,91,91,0,0,0,91,92,0,0,0,100,102,0,0,0,75,100,81,200,0,0,0,75,100,2017-03-22
"3/23/2017",91,91,0,0,0,85,75,0,0,0,91,91,0,0,0,91,92,0,0,0,103,102,0,0,0,75,100,80,196,0,0,0,75,100,2017-03-23
"3/24/2017",91,91,0,0,0,83,15,0,0,0,91,91,0,0,0,91,92,0,0,0,105,102,0,0,0,75,100,85,200,0,0,0,75,100,2017-03-24
"3/27/2017",91,91,0,0,0,89,75,0,0,0,91,91,0,0,0,91,92,0,0,0,103,102,0,0,0,75,100,84,189,0,0,0,75,100,2017-03-27
"3/28/2017",91,91,0,0,0,80,75,0,0,0,91,91,0,0,0,91,92,0,0,0,100,102,0,0,0,75,100,86,184,0,0,0,75,100,2017-03-28
"3/29/2017",91,91,0,0,0,89,65,0,0,0,91,91,0,0,0,91,92,0,0,0,100,102,0,0,0,75,100,84,174,0,0,0,75,100,2017-03-29
"3/30/2017",91,91,0,0,0,83,70,0,0,0,91,91,0,0,0,91,92,0,0,0,100,102,0,0,0,75,100,79,171,0,0,0,75,100,2017-03-30
"3/31/2017",82,82,0,0,0,75,70,0,0,0,80,80,0,0,0,82,82,0,0,0,100,102,0,0,0,75,100,74,167,0,0,0,75,100,2017-03-31
"4/3/2017",91,91,0,0,0,77,75,0,0,0,91,91,0,0,0,91,92,0,0,0,100,102,0,0,0,75,100,82,189,0,0,0,75,100,2017-04-03
"4/4/2017",91,91,0,0,0,80,75,0,0,0,91,91,0,0,0,91,92,0,0,0,97,102,0,0,0,75,100,81,193,0,0,0,75,100,2017-04-04
"4/5/2017",91,91,0,0,0,83,75,0,0,0,91,91,0,0,0,91,92,0,0,0,97,102,0,0,0,75,100,76,189,0,0,0,75,100,2017-04-05
"4/6/2017",91,91,0,0,0,85,75,0,0,0,91,91,0,0,0,91,92,0,0,0,100,102,0,0,0,75,100,79,192,0,0,0,75,100,2017-04-06
"4/7/2017",91,91,0,0,0,80,75,0,0,0,91,91,0,0,0,91,92,0,0,0,100,102,0,0,0,75,100,78,191,0,0,0,75,100,2017-04-07
"4/10/2017",91,91,0,0,0,80,75,0,0,0,91,91,0,0,0,92,92,0,0,0,100,102,0,0,0,75,100,74,187,0,0,0,75,100,2017-04-10
"4/11/2017",91,91,0,0,0,80,75,0,0,0,91,91,0,0,0,92,92,0,0,0,100,102,0,0,0,75,100,75,193,0,0,0,75,100,2017-04-11
"4/12/2017",91,91,0,0,0,80,75,0,0,0,91,91,0,0,0,92,92,0,0,0,100,102,0,0,0,75,100,78,190,0,0,0,75,100,2017-04-12
"4/13/2017",91,91,0,0,0,80,65,0,0,0,91,91,0,0,0,92,92,0,0,0,100,102,0,0,0,75,100,78,104,0,0,0,0,100,2017-04-13
"4/14/2017",91,91,0,0,0,80,65,0,0,0,91,91,0,0,0,91,91,0,0,0,100,102,0,0,0,75,100,80,97,0,0,0,0,100,2017-04-14
"4/17/2017",91,91,0,0,0,83,75,0,0,0,91,91,0,0,0,91,92,0,0,0,100,102,0,0,0,75,100,73,192,0,0,0,75,100,2017-04-17
"4/18/2017",91,91,0,0,0,89,75,0,0,0,91,91,0,0,0,92,92,0,0,0,100,102,0,0,0,75,100,68,193,0,0,0,75,100,2017-04-18
"4/19/2017",91,91,0,0,0,90,75,0,0,0,91,91,0,0,0,92,92,0,0,0,100,102,0,0,0,75,100,73,194,0,0,0,75,100,2017-04-19
"4/20/2017",91,91,0,0,0,90,75,0,0,0,91,91,0,0,0,92,92,0,0,0,100,102,0,0,0,75,100,76,197,0,0,0,75,100,2017-04-20
"4/21/2017",91,91,0,0,0,89,75,0,0,0,91,91,0,0,0,92,92,0,0,0,100,102,0,0,0,75,100,73,202,0,0,0,75,100,2017-04-21
"4/24/2017",91,91,0,0,0,90,15,0,0,0,91,91,0,0,0,92,92,0,0,0,105,102,0,0,0,75,100,69,202,0,0,0,75,100,2017-04-24
"4/25/2017",91,91,0,0,0,89,75,0,0,0,91,91,0,0,0,92,92,0,0,0,105,102,0,0,0,75,100,68,191,0,0,0,75,100,2017-04-25
"4/26/2017",91,91,0,0,0,89,78,0,0,0,91,91,0,0,0,92,92,0,0,0,100,102,0,0,0,75,100,74,188,0,0,0,75,100,2017-04-26
"4/27/2017",91,91,0,0,0,82,55,0,0,0,91,91,0,0,0,92,92,0,0,0,105,102,0,0,0,75,100,72,186,0,0,0,75,100,2017-04-27
"4/28/2017",83,83,0,0,0,80,79,0,0,0,82,82,0,0,0,84,83,0,0,0,106,106,0,0,0,75,100,65,169,0,0,0,75,100,2017-04-28
"5/1/2017",91,91,0,0,0,89,75,0,0,0,91,91,0,0,0,92,92,0,0,0,105,102,0,0,0,75,100,70,174,0,0,0,75,100,2017-05-01
"5/2/2017",91,91,0,0,0,90,80,0,0,0,91,91,0,0,0,92,92,0,0,0,103,102,0,0,0,75,100,71,195,0,0,0,75,100,2017-05-02
"5/3/2017",91,91,0,0,0,89,75,0,0,0,91,91,0,0,0,92,92,0,0,0,100,102,0,0,0,75,100,75,197,0,0,0,75,100,2017-05-03
"5/4/2017",91,91,0,0,0,90,78,0,0,0,91,91,0,0,0,92,92,0,0,0,103,102,0,0,0,75,100,74,199,0,0,0,75,100,2017-05-04
"5/5/2017",91,91,0,0,0,90,77,0,0,0,91,91,0,0,0,92,92,0,0,0,100,102,0,0,0,75,100,79,196,0,0,0,75,100,2017-05-05
"5/8/2017",91,91,0,0,0,89,80,0,0,0,91,91,0,0,0,92,92,0,0,0,100,102,0,0,0,75,100,78,197,0,0,0,75,100,2017-05-08
"5/9/2017",91,91,0,0,0,89,80,0,0,0,91,91,0,0,0,92,92,0,0,0,100,102,0,0,0,75,100,74,196,0,0,0,75,100,2017-05-09
"5/10/2017",91,91,0,0,0,89,80,0,0,0,91,91,0,0,0,92,92,0,0,0,100,102,0,0,0,75,100,73,198,0,0,0,75,100,2017-05-10
"5/11/2017",91,91,0,0,0,89,80,0,0,0,91,91,0,0,0,92,92,0,0,0,97,102,0,0,0,75,100,73,198,0,0,0,75,100,2017-05-11
"5/12/2017",91,91,0,0,0,89,78,0,0,0,91,91,0,0,0,92,92,0,0,0,97,102,0,0,0,75,100,78,199,0,0,0,75,100,2017-05-12
"5/15/2017",91,91,0,0,0,89,78,0,0,0,91,91,0,0,0,92,92,0,0,0,97,103,0,0,0,75,100,83,213,0,0,0,75,100,2017-05-15
"5/16/2017",91,91,0,0,0,85,75,0,0,0,91,91,0,0,0,92,93,0,0,0,100,103,0,0,0,75,100,79,209,0,0,0,75,100,2017-05-16
"5/17/2017",91,91,0,0,0,89,80,0,0,0,91,91,0,0,0,92,92,0,0,0,100,103,0,0,0,75,100,80,204,0,0,0,75,100,2017-05-17
"5/18/2017",91,91,0,0,0,90,80,0,0,0,91,91,0,0,0,92,92,0,0,0,100,103,0,0,0,75,100,73,196,0,0,0,75,100,2017-05-18
"5/19/2017",91,91,0,0,0,90,80,0,0,0,91,91,0,0,0,92,92,0,0,0,100,103,0,0,0,75,100,82,206,0,0,0,75,100,2017-05-19
"5/22/2017",91,91,0,0,0,90,78,0,0,0,91,91,0,0,0,92,92,0,0,0,105,103,0,0,0,75,100,80,207,0,0,0,75,100,2017-05-22
"5/23/2017",91,91,0,0,0,90,80,0,0,0,91,91,0,0,0,92,92,0,0,0,105,103,0,0,0,75,100,79,203,0,0,0,75,100,2017-05-23
"5/24/2017",91,91,0,0,0,90,15,0,0,0,91,91,0,0,0,92,92,0,0,0,100,103,0,0,0,75,100,79,202,0,0,0,75,100,2017-05-24
"5/25/2017",91,91,0,0,0,90,78,0,0,0,91,91,0,0,0,92,92,0,0,0,105,103,0,0,0,75,100,86,210,0,0,0,75,100,2017-05-25
"5/26/2017",91,91,0,0,0,90,80,0,0,0,91,91,0,0,0,92,92,0,0,0,100,103,0,0,0,75,100,85,198,0,0,0,75,100,2017-05-26
"5/30/2017",91,91,0,0,0,90,80,0,0,0,91,91,0,0,0,92,92,0,0,0,100,103,0,0,0,75,100,86,206,0,0,0,75,100,2017-05-30
"5/31/2017",83,83,0,0,0,81,75,0,0,0,82,82,0,0,0,83,83,0,0,0,105,103,0,0,0,75,100,79,197,0,0,0,75,100,2017-05-31
"6/1/2017",91,91,0,0,0,80,80,0,0,0,91,91,0,0,0,92,92,0,0,0,105,103,0,0,0,75,100,84,201,0,0,0,75,100,2017-06-01
"6/2/2017",91,91,0,0,0,90,80,0,0,0,91,91,0,0,0,92,92,0,0,0,100,103,0,0,0,75,100,92,215,0,0,0,75,100,2017-06-02
"6/5/2017",91,91,0,0,0,90,78,0,0,0,91,91,0,0,0,92,92,0,0,0,105,103,0,0,0,75,100,88,218,0,0,0,75,100,2017-06-05
"6/6/2017",91,91,0,0,0,90,78,0,0,0,91,91,0,0,0,92,92,0,0,0,100,103,0,0,0,75,100,86,211,0,0,0,75,100,2017-06-06
"6/7/2017",91,91,0,0,0,90,80,0,0,0,91,91,0,0,0,92,92,0,0,0,100,103,0,0,0,75,100,86,205,0,0,0,75,100,2017-06-07
"6/8/2017",91,91,0,0,0,90,80,0,0,0,91,91,0,0,0,92,92,0,0,0,100,103,0,0,0,75,100,87,205,0,0,0,75,100,2017-06-08
"6/9/2017",91,91,0,0,0,90,82,0,0,0,91,91,0,0,0,92,92,0,0,0,100,102,0,0,0,75,100,84,203,0,0,0,75,100,2017-06-09
"6/12/2017",91,91,0,0,0,89,70,0,0,0,91,91,0,0,0,92,92,0,0,0,103,102,0,0,0,75,100,80,201,0,0,0,75,100,2017-06-12
"6/13/2017",91,91,0,0,0,90,70,0,0,0,91,91,0,0,0,92,92,0,0,0,105,103,0,0,0,75,100,79,202,0,0,0,75,100,2017-06-13
"6/14/2017",91,91,0,0,0,89,80,0,0,0,91,91,0,0,0,92,92,0,0,0,100,103,0,0,0,75,100,75,197,0,0,0,75,100,2017-06-14
"6/15/2017",116,116,0,0,0,115,105,0,0,0,116,116,0,0,0,117,117,0,0,0,122,128,0,0,0,100,125,73,199,0,0,0,100,125,2017-06-15
"6/16/2017",116,116,0,0,0,115,105,0,0,0,116,116,0,0,0,117,117,0,0,0,125,128,0,0,0,100,125,72,197,0,0,0,100,125,2017-06-16
"6/19/2017",116,116,0,0,0,115,100,0,0,0,116,116,0,0,0,117,117,0,0,0,125,128,0,0,0,100,125,74,202,0,0,0,100,125,2017-06-19
"6/20/2017",116,116,0,0,0,114,100,0,0,0,116,116,0,0,0,117,117,0,0,0,128,128,0,0,0,100,125,79,212,0,0,0,100,125,2017-06-20
"6/21/2017",116,116,0,0,0,115,100,0,0,0,116,116,0,0,0,117,117,0,0,0,128,128,0,0,0,100,125,79,206,0,0,0,100,125,2017-06-21
"6/22/2017",116,116,0,0,0,115,100,0,0,0,116,116,0,0,0,117,117,0,0,0,131,128,0,0,0,100,125,78,201,0,0,0,100,125,2017-06-22
"6/23/2017",116,116,0,0,0,115,15,0,0,0,116,116,0,0,0,117,117,0,0,0,131,128,0,0,0,100,125,83,205,0,0,0,100,125,2017-06-23
"6/26/2017",116,116,0,0,0,115,100,0,0,0,116,116,0,0,0,117,117,0,0,0,131,128,0,0,0,100,125,81,201,0,0,0,100,125,2017-06-26
"6/27/2017",116,116,0,0,0,115,100,0,0,0,116,116,0,0,0,117,117,0,0,0,131,128,0,0,0,100,125,82,206,0,0,0,100,125,2017-06-27
"6/28/2017",116,116,0,0,0,115,100,0,0,0,116,116,0,0,0,117,117,0,0,0,130,128,0,0,0,100,125,86,194,0,0,0,100,125,2017-06-28
"6/29/2017",116,116,0,0,0,115,100,0,0,0,116,116,0,0,0,117,117,0,0,0,130,128,0,0,0,100,125,88,192,0,0,0,100,125,2017-06-29
"6/30/2017",106,106,0,0,0,102,90,0,0,0,105,105,0,0,0,106,106,0,0,0,131,131,0,0,0,100,125,72,152,0,0,0,100,125,2017-06-30
"7/3/2017",116,116,0,0,0,114,100,0,0,0,116,116,0,0,0,117,117,0,0,0,131,128,0,0,0,100,125,85,186,0,0,0,100,125,2017-07-03
"7/5/2017",116,116,0,0,0,105,100,0,0,0,116,116,0,0,0,117,117,0,0,0,130,128,0,0,0,100,125,83,208,0,0,0,100,125,2017-07-05
"7/6/2017",116,116,0,0,0,115,105,0,0,0,116,116,0,0,0,117,117,0,0,0,130,128,0,0,0,100,125,82,210,0,0,0,100,125,2017-07-06
"7/7/2017",116,116,0,0,0,115,105,0,0,0,116,116,0,0,0,117,117,0,0,0,128,128,0,0,0,100,125,89,206,0,0,0,100,125,2017-07-07
"7/10/2017",116,116,0,0,0,115,100,0,0,0,116,116,0,0,0,117,117,0,0,0,130,128,0,0,0,100,125,89,208,0,0,0,100,125,2017-07-10
"7/11/2017",116,116,0,0,0,114,103,0,0,0,116,116,0,0,0,117,117,0,0,0,125,128,0,0,0,100,125,92,214,0,0,0,100,125,2017-07-11
"7/12/2017",116,116,0,0,0,115,103,0,0,0,116,116,0,0,0,117,117,0,0,0,125,128,0,0,0,100,125,92,209,0,0,0,100,125,2017-07-12
"7/13/2017",116,116,0,0,0,115,104,0,0,0,116,116,0,0,0,117,117,0,0,0,125,128,0,0,0,100,125,89,202,0,0,0,100,125,2017-07-13
"7/14/2017",116,116,0,0,0,114,104,0,0,0,116,116,0,0,0,117,117,0,0,0,125,128,0,0,0,100,125,91,211,0,0,0,100,125,2017-07-14
"7/17/2017",116,116,0,0,0,112,105,0,0,0,116,116,0,0,0,117,117,0,0,0,130,128,0,0,0,100,125,92,212,0,0,0,100,125,2017-07-17
"7/18/2017",116,116,0,0,0,112,105,0,0,0,116,116,0,0,0,117,117,0,0,0,125,127,0,0,0,100,125,87,189,0,0,0,100,125,2017-07-18
"7/19/2017",116,116,0,0,0,115,102,0,0,0,116,116,0,0,0,117,117,0,0,0,125,127,0,0,0,100,125,85,203,0,0,0,100,125,2017-07-19
"7/20/2017",116,116,0,0,0,115,105,0,0,0,116,116,0,0,0,117,117,0,0,0,130,128,0,0,0,100,125,88,214,0,0,0,100,125,2017-07-20
"7/21/2017",116,116,0,0,0,115,102,0,0,0,116,116,0,0,0,117,117,0,0,0,131,128,0,0,0,100,125,90,213,0,0,0,100,125,2017-07-21
"7/24/2017",116,116,0,0,0,115,40,0,0,0,116,116,0,0,0,117,117,0,0,0,130,128,0,0,0,100,125,88,211,0,0,0,100,125,2017-07-24
"7/25/2017",116,116,0,0,0,115,100,0,0,0,116,116,0,0,0,117,117,0,0,0,125,128,0,0,0,100,125,92,219,0,0,0,100,125,2017-07-25
"7/26/2017",116,116,0,0,0,114,102,0,0,0,116,116,0,0,0,117,117,0,0,0,128,128,0,0,0,100,125,89,217,0,0,0,100,125,2017-07-26
"7/27/2017",116,116,0,0,0,115,102,0,0,0,116,116,0,0,0,117,117,0,0,0,125,128,0,0,0,100,125,99,219,0,0,0,100,125,2017-07-27
"7/28/2017",116,116,0,0,0,114,100,0,0,0,116,116,0,0,0,117,117,0,0,0,125,128,0,0,0,100,125,100,221,0,0,0,100,125,2017-07-28
"7/31/2017",107,107,0,0,0,104,100,0,0,0,107,107,0,0,0,107,108,0,0,0,125,128,0,0,0,100,125,94,212,0,0,0,100,125,2017-07-31
"8/1/2017",116,116,0,0,0,110,105,0,0,0,116,116,0,0,0,117,117,0,0,0,122,128,0,0,0,100,125,100,220,0,0,0,100,125,2017-08-01
"8/2/2017",116,116,0,0,0,115,104,0,0,0,116,116,0,0,0,117,117,0,0,0,125,128,0,0,0,100,125,106,229,0,0,0,100,125,2017-08-02
"8/3/2017",116,116,0,0,0,115,102,0,0,0,116,116,0,0,0,117,117,0,0,0,125,128,0,0,0,100,125,106,233,0,0,0,100,125,2017-08-03
"8/4/2017",116,116,0,0,0,115,105,0,0,0,116,116,0,0,0,117,117,0,0,0,125,128,0,0,0,100,125,102,225,0,0,0,100,125,2017-08-04
"8/7/2017",116,116,0,0,0,114,103,0,0,0,116,116,0,0,0,117,117,0,0,0,125,128,0,0,0,100,125,102,224,0,0,0,100,125,2017-08-07
"8/8/2017",116,116,0,0,0,114,103,0,0,0,116,116,0,0,0,117,117,0,0,0,125,128,0,0,0,100,125,102,223,0,0,0,100,125,2017-08-08
"8/9/2017",116,116,0,0,0,115,105,0,0,0,116,116,0,0,0,117,117,0,0,0,125,128,0,0,0,100,125,96,220,0,0,0,100,125,2017-08-09
"8/10/2017",116,116,0,0,0,114,105,0,0,0,116,116,0,0,0,117,117,0,0,0,125,127,0,0,0,100,125,98,221,0,0,0,100,125,2017-08-10
"8/11/2017",116,116,0,0,0,110,105,0,0,0,116,116,0,0,0,117,117,0,0,0,125,127,0,0,0,100,125,97,220,0,0,0,100,125,2017-08-11
"8/14/2017",116,116,0,0,0,114,100,0,0,0,116,116,0,0,0,117,117,0,0,0,125,130,0,0,0,100,125,95,220,0,0,0,100,125,2017-08-14
"8/15/2017",116,116,0,0,0,114,105,0,0,0,116,116,0,0,0,117,117,0,0,0,125,127,0,0,0,100,125,93,216,0,0,0,100,125,2017-08-15
"8/16/2017",116,116,0,0,0,114,105,0,0,0,116,116,0,0,0,117,117,0,0,0,122,127,0,0,0,100,125,101,226,0,0,0,100,125,2017-08-16
"8/17/2017",116,116,0,0,0,115,100,0,0,0,116,116,0,0,0,117,117,0,0,0,125,127,0,0,0,100,125,95,224,0,0,0,100,125,2017-08-17
"8/18/2017",116,116,0,0,0,115,102,0,0,0,116,116,0,0,0,117,117,0,0,0,125,127,0,0,0,100,125,94,212,0,0,0,100,125,2017-08-18
"8/21/2017",116,116,0,0,0,114,105,0,0,0,116,116,0,0,0,117,117,0,0,0,125,127,0,0,0,100,125,92,216,0,0,0,100,125,2017-08-21
"8/22/2017",116,116,0,0,0,110,100,0,0,0,116,116,0,0,0,117,117,0,0,0,125,127,0,0,0,100,125,93,212,0,0,0,100,125,2017-08-22
"8/23/2017",116,116,0,0,0,114,105,0,0,0,116,116,0,0,0,117,117,0,0,0,125,127,0,0,0,100,125,93,215,0,0,0,100,125,2017-08-23
"8/24/2017",116,116,0,0,0,114,75,0,0,0,116,116,0,0,0,117,117,0,0,0,125,127,0,0,0,100,125,90,215,0,0,0,100,125,2017-08-24
"8/25/2017",116,116,0,0,0,114,102,0,0,0,116,116,0,0,0,117,117,0,0,0,125,127,0,0,0,100,125,97,216,0,0,0,100,125,2017-08-25
"8/28/2017",116,116,0,0,0,114,105,0,0,0,116,116,0,0,0,117,117,0,0,0,125,127,0,0,0,100,125,92,209,0,0,0,100,125,2017-08-28
"8/29/2017",116,116,0,0,0,110,105,0,0,0,116,116,0,0,0,117,117,0,0,0,125,127,0,0,0,100,125,92,207,0,0,0,100,125,2017-08-29
"8/30/2017",116,116,0,0,0,115,105,0,0,0,116,116,0,0,0,117,117,0,0,0,125,127,0,0,0,100,125,95,215,0,0,0,100,125,2017-08-30
"8/31/2017",107,107,0,0,0,105,100,0,0,0,107,107,0,0,0,108,108,0,0,0,128,131,0,0,0,100,125,91,213,0,0,0,100,125,2017-08-31
"9/1/2017",116,116,0,0,0,115,105,0,0,0,116,116,0,0,0,117,117,0,0,0,125,127,0,0,0,100,125,97,213,0,0,0,100,125,2017-09-01
"9/5/2017",116,116,0,0,0,114,105,0,0,0,116,116,0,0,0,117,117,0,0,0,125,127,0,0,0,100,125,93,217,0,0,0,100,125,2017-09-05
"9/6/2017",116,116,0,0,0,113,105,0,0,0,116,116,0,0,0,117,117,0,0,0,122,127,0,0,0,100,125,93,215,0,0,0,100,125,2017-09-06
"9/7/2017",116,116,0,0,0,115,105,0,0,0,116,116,0,0,0,117,117,0,0,0,125,127,0,0,0,100,125,89,208,0,0,0,100,125,2017-09-07
"9/8/2017",116,116,0,0,0,115,105,0,0,0,116,116,0,0,0,117,117,0,0,0,125,127,0,0,0,100,125,92,210,0,0,0,100,125,2017-09-08
"9/11/2017",116,116,0,0,0,115,100,0,0,0,116,116,0,0,0,117,117,0,0,0,125,127,0,0,0,100,125,90,216,0,0,0,100,125,2017-09-11
"9/12/2017",116,116,0,0,0,115,105,0,0,0,116,116,0,0,0,117,117,0,0,0,125,127,0,0,0,100,125,93,212,0,0,0,100,125,2017-09-12
"9/13/2017",116,116,0,0,0,113,105,0,0,0,116,116,0,0,0,117,117,0,0,0,122,127,0,0,0,100,125,95,214,0,0,0,100,125,2017-09-13
"9/14/2017",116,116,0,0,0,113,104,0,0,0,116,116,0,0,0,117,117,0,0,0,125,127,0,0,0,100,125,84,196,0,0,0,100,125,2017-09-14
"9/15/2017",116,116,0,0,0,110,100,0,0,0,116,116,0,0,0,117,117,0,0,0,125,127,0,0,0,100,125,92,205,0,0,0,100,125,2017-09-15
"9/18/2017",116,116,0,0,0,115,110,0,0,0,116,116,0,0,0,117,117,0,0,0,130,127,0,0,0,100,125,83,213,0,0,0,100,125,2017-09-18
"9/19/2017",116,116,0,0,0,115,104,0,0,0,116,116,0,0,0,117,117,0,0,0,125,127,0,0,0,100,125,81,210,0,0,0,100,125,2017-09-19
"9/20/2017",116,116,0,0,0,115,100,0,0,0,116,116,0,0,0,117,117,0,0,0,130,127,0,0,0,100,125,81,212,0,0,0,100,125,2017-09-20
"9/21/2017",116,117,0,0,0,115,100,0,0,0,116,116,0,0,0,117,117,0,0,0,130,127,0,0,0,100,125,83,199,0,0,0,100,125,2017-09-21
"9/22/2017",116,116,0,0,0,113,30,0,0,0,116,116,0,0,0,117,117,0,0,0,125,127,0,0,0,100,125,96,217,0,0,0,100,125,2017-09-22
"9/25/2017",116,116,0,0,0,115,100,0,0,0,116,116,0,0,0,117,117,0,0,0,125,127,0,0,0,100,125,96,209,0,0,0,100,125,2017-09-25
"9/26/2017",116,116,0,0,0,105,103,0,0,0,116,116,0,0,0,117,117,0,0,0,125,127,0,0,0,100,125,93,203,0,0,0,100,125,2017-09-26
"9/27/2017",116,116,0,0,0,113,101,0,0,0,116,116,0,0,0,117,117,0,0,0,125,127,0,0,0,100,125,98,200,0,0,0,100,125,2017-09-27
"9/28/2017",116,116,0,0,0,111,101,0,0,0,116,116,0,0,0,117,117,0,0,0,125,127,0,0,0,100,125,98,211,0,0,0,100,125,2017-09-28
"9/29/2017",106,106,0,0,0,103,100,0,0,0,105,105,0,0,0,107,107,0,0,0,130,127,0,0,0,100,125,84,200,0,0,0,100,125,2017-09-29
"10/2/2017",116,116,0,0,0,105,100,0,0,0,116,116,0,0,0,117,117,0,0,0,125,127,0,0,0,100,125,93,205,0,0,0,100,125,2017-10-02
"10/3/2017",116,116,0,0,0,114,103,0,0,0,116,116,0,0,0,117,117,0,0,0,125,127,0,0,0,100,125,91,209,0,0,0,100,125,2017-10-03
"10/4/2017",116,116,0,0,0,105,103,0,0,0,116,116,0,0,0,117,117,0,0,0,122,127,0,0,0,100,125,93,208,0,0,0,100,125,2017-10-04
"10/5/2017",116,116,0,0,0,111,103,0,0,0,116,116,0,0,0,117,117,0,0,0,125,127,0,0,0,100,125,94,208,0,0,0,100,125,2017-10-05
"10/6/2017",116,116,0,0,0,114,100,0,0,0,116,116,0,0,0,117,117,0,0,0,125,127,0,0,0,100,125,95,210,0,0,0,100,125,2017-10-06
"10/10/2017",116,116,0,0,0,115,105,0,0,0,116,116,0,0,0,117,117,0,0,0,125,127,0,0,0,100,125,91,209,0,0,0,100,125,2017-10-10
"10/11/2017",116,116,0,0,0,114,105,0,0,0,116,116,0,0,0,117,117,0,0,0,125,127,0,0,0,100,125,90,207,0,0,0,100,125,2017-10-11
"10/12/2017",116,116,0,0,0,115,105,0,0,0,116,116,0,0,0,117,117,0,0,0,125,127,0,0,0,100,125,87,204,0,0,0,100,125,2017-10-12
"10/13/2017",116,116,0,0,0,115,105,0,0,0,116,116,0,0,0,117,117,0,0,0,125,127,0,0,0,100,125,92,205,0,0,0,100,125,2017-10-13
"10/16/2017",116,116,0,0,0,115,105,0,0,0,116,116,0,0,0,117,117,0,0,0,128,127,0,0,0,100,125,91,212,0,0,0,100,125,2017-10-16
"10/17/2017",116,116,0,0,0,115,105,0,0,0,116,116,0,0,0,117,117,0,0,0,125,127,0,0,0,100,125,86,210,0,0,0,100,125,2017-10-17
"10/18/2017",116,116,0,0,0,115,105,0,0,0,116,116,0,0,0,117,117,0,0,0,125,127,0,0,0,100,125,87,208,0,0,0,100,125,2017-10-18
"10/19/2017",116,116,0,0,0,114,105,0,0,0,116,116,0,0,0,117,117,0,0,0,125,127,0,0,0,100,125,86,204,0,0,0,100,125,2017-10-19
"10/20/2017",116,116,0,0,0,115,105,0,0,0,116,116,0,0,0,117,117,0,0,0,125,127,0,0,0,100,125,86,209,0,0,0,100,125,2017-10-20
"10/23/2017",116,116,0,0,0,114,103,0,0,0,116,116,0,0,0,117,117,0,0,0,125,127,0,0,0,100,125,85,212,0,0,0,100,125,2017-10-23
"10/24/2017",116,116,0,0,0,115,30,0,0,0,116,116,0,0,0,117,117,0,0,0,125,127,0,0,0,100,125,90,217,0,0,0,100,125,2017-10-24
"10/25/2017",116,116,0,0,0,115,105,0,0,0,116,116,0,0,0,117,117,0,0,0,125,127,0,0,0,100,125,93,219,0,0,0,100,125,2017-10-25
"10/26/2017",116,116,0,0,0,115,107,0,0,0,116,116,0,0,0,117,117,0,0,0,125,127,0,0,0,100,125,97,221,0,0,0,100,125,2017-10-26
"10/27/2017",116,116,0,0,0,115,102,0,0,0,116,116,0,0,0,117,117,0,0,0,125,127,0,0,0,100,125,97,216,0,0,0,100,125,2017-10-27
"10/30/2017",116,116,0,0,0,115,102,0,0,0,116,116,0,0,0,117,117,0,0,0,125,127,0,0,0,100,125,92,221,0,0,0,100,125,2017-10-30
"10/31/2017",107,107,0,0,0,105,100,0,0,0,107,106,0,0,0,108,108,0,0,0,128,127,0,0,0,100,125,93,215,0,0,0,100,125,2017-10-31
"11/1/2017",116,116,0,0,0,112,105,0,0,0,116,116,0,0,0,117,117,0,0,0,125,127,0,0,0,100,125,99,209,0,0,0,100,125,2017-11-01
"11/2/2017",116,116,0,0,0,115,105,0,0,0,116,116,0,0,0,117,117,0,0,0,125,127,0,0,0,100,125,96,217,0,0,0,100,125,2017-11-02
"11/3/2017",116,116,0,0,0,114,105,0,0,0,116,116,0,0,0,117,117,0,0,0,125,127,0,0,0,100,125,98,221,0,0,0,100,125,2017-11-03
"11/6/2017",116,116,0,0,0,114,104,0,0,0,116,116,0,0,0,117,117,0,0,0,125,127,0,0,0,100,125,94,220,0,0,0,100,125,2017-11-06
"11/7/2017",116,116,0,0,0,114,103,0,0,0,116,116,0,0,0,117,117,0,0,0,125,127,0,0,0,100,125,98,225,0,0,0,100,125,2017-11-07
"11/8/2017",116,116,0,0,0,115,105,0,0,0,116,116,0,0,0,117,117,0,0,0,125,127,0,0,0,100,125,97,228,0,0,0,100,125,2017-11-08
"11/9/2017",116,116,0,0,0,114,107,0,0,0,116,116,0,0,0,117,117,0,0,0,122,127,0,0,0,100,125,97,221,0,0,0,100,125,2017-11-09
"11/10/2017",116,116,0,0,0,114,105,0,0,0,116,116,0,0,0,117,117,0,0,0,125,128,0,0,0,100,125,98,210,0,0,0,100,125,2017-11-10
"11/13/2017",116,116,0,0,0,114,105,0,0,0,116,116,0,0,0,117,117,0,0,0,125,127,0,0,0,100,125,93,217,0,0,0,100,125,2017-11-13
"11/14/2017",116,116,0,0,0,114,109,0,0,0,116,116,0,0,0,117,117,0,0,0,125,127,0,0,0,100,125,86,212,0,0,0,100,125,2017-11-14
"11/15/2017",116,116,0,0,0,114,106,0,0,0,116,116,0,0,0,117,117,0,0,0,128,127,0,0,0,100,125,89,211,0,0,0,100,125,2017-11-15
"11/16/2017",116,116,0,0,0,113,105,0,0,0,116,116,0,0,0,117,117,0,0,0,128,127,0,0,0,100,125,84,208,0,0,0,100,125,2017-11-16
"11/17/2017",116,116,0,0,0,114,110,0,0,0,116,116,0,0,0,117,117,0,0,0,130,128,0,0,0,100,125,84,203,0,0,0,100,125,2017-11-17
"11/20/2017",116,116,0,0,0,114,110,0,0,0,116,116,0,0,0,117,117,0,0,0,128,127,0,0,0,100,125,90,209,0,0,0,100,125,2017-11-20
"11/21/2017",116,116,0,0,0,105,105,0,0,0,116,116,0,0,0,117,117,0,0,0,128,127,0,0,0,100,125,90,213,0,0,0,100,125,2017-11-21
"11/22/2017",116,116,0,0,0,114,105,0,0,0,116,116,0,0,0,117,117,0,0,0,128,127,0,0,0,100,125,86,201,0,0,0,100,125,2017-11-22
"11/24/2017",116,116,0,0,0,113,30,0,0,0,116,116,0,0,0,117,117,0,0,0,130,127,0,0,0,100,125,84,193,0,0,0,100,125,2017-11-24
"11/27/2017",116,116,0,0,0,114,110,0,0,0,116,116,0,0,0,117,117,0,0,0,130,127,0,0,0,100,125,88,211,0,0,0,100,125,2017-11-27
"11/28/2017",116,116,0,0,0,114,110,0,0,0,116,116,0,0,0,117,117,0,0,0,130,127,0,0,0,100,125,87,207,0,0,0,100,125,2017-11-28
"11/29/2017",116,116,0,0,0,114,110,0,0,0,116,116,0,0,0,117,117,0,0,0,125,127,0,0,0,100,125,89,211,0,0,0,100,125,2017-11-29
"11/30/2017",107,108,0,0,0,105,104,0,0,0,107,107,0,0,0,108,108,0,0,0,130,127,0,0,0,100,125,81,198,0,0,0,100,125,2017-11-30
"12/1/2017",116,116,0,0,0,105,105,0,0,0,116,116,0,0,0,117,117,0,0,0,128,128,0,0,0,100,125,101,216,0,0,0,100,125,2017-12-01
"12/4/2017",116,116,0,0,0,115,107,0,0,0,116,116,0,0,0,117,117,0,0,0,125,127,0,0,0,100,125,94,215,0,0,0,100,125,2017-12-04
"12/5/2017",116,116,0,0,0,114,107,0,0,0,116,116,0,0,0,117,117,0,0,0,128,127,0,0,0,100,125,93,215,0,0,0,100,125,2017-12-05
"12/6/2017",116,116,0,0,0,115,106,0,0,0,116,116,0,0,0,117,117,0,0,0,130,127,0,0,0,100,125,90,205,0,0,0,100,125,2017-12-06
"12/7/2017",116,116,0,0,0,115,106,0,0,0,116,116,0,0,0,117,117,0,0,0,130,127,0,0,0,100,125,93,201,0,0,0,100,125,2017-12-07
"12/8/2017",116,116,0,0,0,110,109,0,0,0,116,116,0,0,0,117,117,0,0,0,125,127,0,0,0,100,125,94,203,0,0,0,100,125,2017-12-08
"12/11/2017",116,116,0,0,0,115,109,0,0,0,116,116,0,0,0,117,117,0,0,0,130,135,0,0,0,100,125,92,211,0,0,0,100,125,2017-12-11
"12/12/2017",117,116,0,0,0,115,109,0,0,0,116,116,0,0,0,117,117,0,0,0,130,135,0,0,0,100,125,94,211,0,0,0,100,125,2017-12-12
"12/13/2017",117,116,0,0,0,115,109,0,0,0,116,116,0,0,0,117,118,0,0,0,130,135,0,0,0,100,125,97,214,0,0,0,100,125,2017-12-13
"12/14/2017",141,141,0,0,0,139,130,0,0,0,141,141,0,0,0,142,142,0,0,0,150,152,0,0,0,125,150,85,199,0,0,0,125,150,2017-12-14
"12/15/2017",141,141,0,0,0,139,125,0,0,0,141,141,0,0,0,142,142,0,0,0,150,152,0,0,0,125,150,91,204,0,0,0,125,150,2017-12-15
"12/18/2017",142,141,0,0,0,139,128,0,0,0,141,141,0,0,0,142,142,0,0,0,155,152,0,0,0,125,150,84,190,0,0,0,125,150,2017-12-18
"12/19/2017",142,142,0,0,0,139,128,0,0,0,141,141,0,0,0,143,143,0,0,0,153,152,0,0,0,125,150,89,202,0,0,0,125,150,2017-12-19
"12/20/2017",142,142,0,0,0,135,125,0,0,0,141,141,0,0,0,142,143,0,0,0,155,152,0,0,0,125,150,91,194,0,0,0,125,150,2017-12-20
"12/21/2017",142,142,0,0,0,135,125,0,0,0,141,141,0,0,0,142,143,0,0,0,155,152,0,0,0,125,150,89,202,0,0,0,125,150,2017-12-21
"12/22/2017",142,142,0,0,0,135,50,0,0,0,141,141,0,0,0,142,143,0,0,0,150,152,0,0,0,125,150,89,198,0,0,0,125,150,2017-12-22
"12/26/2017",142,142,0,0,0,139,130,0,0,0,141,141,0,0,0,142,143,0,0,0,155,152,0,0,0,125,150,91,210,0,0,0,125,150,2017-12-26
"12/27/2017",142,142,0,0,0,140,130,0,0,0,141,141,0,0,0,142,143,0,0,0,155,152,0,0,0,125,150,95,213,0,0,0,125,150,2017-12-27
"12/28/2017",142,142,0,0,0,140,130,0,0,0,141,141,0,0,0,142,143,0,0,0,156,152,0,0,0,125,150,93,198,0,0,0,125,150,2017-12-28
"12/29/2017",133,133,0,0,0,128,120,0,0,0,130,130,0,0,0,133,134,0,0,0,156,156,0,0,0,125,150,62,129,0,0,0,125,150,2017-12-29
"1/2/2018",142,142,0,0,0,135,130,0,0,0,141,141,0,0,0,142,143,0,0,0,156,152,0,0,0,125,150,84,189,0,0,0,125,150,2018-01-02
"1/3/2018",142,142,0,0,0,140,130,0,0,0,141,141,0,0,0,142,143,0,0,0,153,152,0,0,0,125,150,93,208,0,0,0,125,150,2018-01-03
"1/4/2018",142,142,0,0,0,135,130,0,0,0,141,141,0,0,0,143,143,0,0,0,150,152,0,0,0,125,150,92,204,0,0,0,125,150,2018-01-04
"1/5/2018",142,142,0,0,0,130,130,0,0,0,141,141,0,0,0,143,143,0,0,0,150,152,0,0,0,125,150,98,214,0,0,0,125,150,2018-01-05
"1/8/2018",142,142,0,0,0,140,130,0,0,0,141,141,0,0,0,143,143,0,0,0,150,152,0,0,0,125,150,93,206,0,0,0,125,150,2018-01-08
"1/9/2018",142,142,0,0,0,140,130,0,0,0,141,141,0,0,0,143,143,0,0,0,150,152,0,0,0,125,150,94,212,0,0,0,125,150,2018-01-09
"1/10/2018",142,142,0,0,0,140,130,0,0,0,141,141,0,0,0,143,143,0,0,0,150,152,0,0,0,125,150,97,211,0,0,0,125,150,2018-01-10
"1/11/2018",142,142,0,0,0,140,130,0,0,0,141,141,0,0,0,143,143,0,0,0,150,152,0,0,0,125,150,95,205,0,0,0,125,150,2018-01-11
"1/12/2018",142,142,0,0,0,140,130,0,0,0,141,141,0,0,0,143,143,0,0,0,150,152,0,0,0,125,150,95,197,0,0,0,125,150,2018-01-12
"1/16/2018",142,142,0,0,0,140,130,0,0,0,141,141,0,0,0,143,143,0,0,0,150,152,0,0,0,125,150,88,205,0,0,0,125,150,2018-01-16
"1/17/2018",142,142,0,0,0,140,130,0,0,0,142,141,0,0,0,143,143,0,0,0,165,154,0,0,0,125,150,93,210,0,0,0,125,150,2018-01-17
"1/18/2018",142,142,0,0,0,140,130,0,0,0,142,141,0,0,0,143,143,0,0,0,150,152,0,0,0,125,150,86,200,0,0,0,125,150,2018-01-18
"1/19/2018",142,142,0,0,0,140,130,0,0,0,142,141,0,0,0,143,143,0,0,0,150,152,0,0,0,125,150,86,196,0,0,0,125,150,2018-01-19
"1/22/2018",142,142,0,0,0,140,130,0,0,0,142,141,0,0,0,143,143,0,0,0,155,152,0,0,0,125,150,87,204,0,0,0,125,150,2018-01-22
"1/23/2018",142,142,0,0,0,140,130,0,0,0,142,141,0,0,0,143,143,0,0,0,155,152,0,0,0,125,150,91,204,0,0,0,125,150,2018-01-23
"1/24/2018",142,142,0,0,0,140,95,0,0,0,142,141,0,0,0,144,143,0,0,0,155,152,0,0,0,125,150,90,212,0,0,0,125,150,2018-01-24
"1/25/2018",142,142,0,0,0,140,130,0,0,0,142,141,0,0,0,144,143,0,0,0,150,152,0,0,0,125,150,88,198,0,0,0,125,150,2018-01-25
"1/26/2018",142,142,0,0,0,140,130,0,0,0,142,141,0,0,0,144,143,0,0,0,150,152,0,0,0,125,150,90,201,0,0,0,125,150,2018-01-26
"1/29/2018",142,142,0,0,0,140,130,0,0,0,142,141,0,0,0,144,143,0,0,0,150,152,0,0,0,125,150,91,210,0,0,0,125,150,2018-01-29
"1/30/2018",142,142,0,0,0,140,132,0,0,0,142,141,0,0,0,143,143,0,0,0,148,152,0,0,0,125,150,102,218,0,0,0,125,150,2018-01-30
"1/31/2018",134,134,0,0,0,130,125,0,0,0,133,133,0,0,0,134,135,0,0,0,150,152,0,0,0,125,150,104,204,0,0,0,125,150,2018-01-31
"2/1/2018",142,142,0,0,0,140,130,0,0,0,142,141,0,0,0,143,143,0,0,0,150,152,0,0,0,125,150,109,224,0,0,0,125,150,2018-02-01
"2/2/2018",142,142,0,0,0,140,130,0,0,0,142,141,0,0,0,143,143,0,0,0,150,152,0,0,0,125,150,108,218,0,0,0,125,150,2018-02-02
"2/5/2018",142,142,0,0,0,140,131,0,0,0,142,141,0,0,0,143,143,0,0,0,150,152,0,0,0,125,150,103,217,0,0,0,125,150,2018-02-05
"2/6/2018",142,142,0,0,0,140,128,0,0,0,142,141,0,0,0,143,143,0,0,0,150,152,0,0,0,125,150,103,209,0,0,0,125,150,2018-02-06
"2/7/2018",142,142,0,0,0,140,128,0,0,0,142,141,0,0,0,143,143,0,0,0,150,152,0,0,0,125,150,104,220,0,0,0,125,150,2018-02-07
"2/8/2018",142,142,0,0,0,140,130,0,0,0,142,141,0,0,0,143,143,0,0,0,150,152,0,0,0,125,150,106,218,0,0,0,125,150,2018-02-08
"2/9/2018",142,142,0,0,0,140,48,0,0,0,142,141,0,0,0,143,143,0,0,0,150,152,0,0,0,125,150,107,219,0,0,0,125,150,2018-02-09
"2/12/2018",142,142,0,0,0,140,135,0,0,0,142,141,0,0,0,144,143,0,0,0,150,152,0,0,0,125,150,97,221,0,0,0,125,150,2018-02-12
"2/13/2018",142,142,0,0,0,140,135,0,0,0,142,141,0,0,0,143,143,0,0,0,150,152,0,0,0,125,150,99,222,0,0,0,125,150,2018-02-13
"2/14/2018",142,142,0,0,0,140,125,0,0,0,142,141,0,0,0,142,142,0,0,0,150,152,0,0,0,125,150,105,218,0,0,0,125,150,2018-02-14
"2/15/2018",142,142,0,0,0,140,130,0,0,0,142,142,0,0,0,142,143,0,0,0,150,152,0,0,0,125,150,101,214,0,0,0,125,150,2018-02-15
"2/16/2018",142,142,0,0,0,140,130,0,0,0,142,141,0,0,0,143,142,0,0,0,155,152,0,0,0,125,150,95,210,0,0,0,125,150,2018-02-16
"2/20/2018",142,142,0,0,0,140,135,0,0,0,142,141,0,0,0,143,143,0,0,0,155,152,0,0,0,125,150,84,196,0,0,0,125,150,2018-02-20
"2/21/2018",142,142,0,0,0,140,130,0,0,0,142,141,0,0,0,143,142,0,0,0,155,152,0,0,0,125,150,88,200,0,0,0,125,150,2018-02-21
"2/22/2018",142,142,0,0,0,140,130,0,0,0,142,141,0,0,0,143,142,0,0,0,150,152,0,0,0,125,150,98,205,0,0,0,125,150,2018-02-22
"2/23/2018",142,142,0,0,0,140,65,0,0,0,142,141,0,0,0,143,143,0,0,0,156,154,0,0,0,125,150,101,216,0,0,0,125,150,2018-02-23
"2/26/2018",142,142,0,0,0,140,130,0,0,0,142,141,0,0,0,143,143,0,0,0,155,152,0,0,0,125,150,97,208,0,0,0,125,150,2018-02-26
"2/27/2018",142,142,0,0,0,140,130,0,0,0,142,141,0,0,0,143,143,0,0,0,155,152,0,0,0,125,150,104,214,0,0,0,125,150,2018-02-27
"2/28/2018",135,135,0,0,0,130,129,0,0,0,134,134,0,0,0,135,135,0,0,0,153,152,0,0,0,125,150,104,204,0,0,0,125,150,2018-02-28
"3/1/2018",142,142,0,0,0,136,130,0,0,0,142,141,0,0,0,143,143,0,0,0,153,152,0,0,0,125,150,115,210,0,0,0,125,150,2018-03-01
"3/2/2018",142,142,0,0,0,140,130,0,0,0,142,141,0,0,0,143,143,0,0,0,150,152,0,0,0,125,150,114,214,0,0,0,125,150,2018-03-02
"3/5/2018",142,142,0,0,0,140,130,0,0,0,142,141,0,0,0,143,143,0,0,0,153,152,0,0,0,125,150,110,214,0,0,0,125,150,2018-03-05
"3/6/2018",142,142,0,0,0,139,130,0,0,0,142,141,0,0,0,143,143,0,0,0,155,152,0,0,0,125,150,112,212,0,0,0,125,150,2018-03-06
"3/7/2018",142,142,0,0,0,139,125,0,0,0,142,141,0,0,0,143,143,0,0,0,153,152,0,0,0,125,150,105,212,0,0,0,125,150,2018-03-07
"3/8/2018",142,142,0,0,0,140,130,0,0,0,142,141,0,0,0,143,143,0,0,0,155,152,0,0,0,125,150,106,209,0,0,0,125,150,2018-03-08
"3/9/2018",142,142,0,0,0,140,130,0,0,0,142,142,0,0,0,143,143,0,0,0,153,152,0,0,0,125,150,104,192,0,0,0,125,150,2018-03-09
"3/12/2018",142,142,0,0,0,140,130,0,0,0,142,142,0,0,0,144,143,0,0,0,155,152,0,0,0,125,150,100,204,0,0,0,125,150,2018-03-12
"3/13/2018",142,142,0,0,0,140,130,0,0,0,142,142,0,0,0,144,143,0,0,0,153,152,0,0,0,125,150,98,188,0,0,0,125,150,2018-03-13
"3/14/2018",142,142,0,0,0,140,135,0,0,0,142,142,0,0,0,144,143,0,0,0,150,152,0,0,0,125,150,103,198,0,0,0,125,150,2018-03-14
"3/15/2018",143,142,0,0,0,140,130,0,0,0,142,142,0,0,0,144,144,0,0,0,156,155,0,0,0,125,150,95,171,0,0,0,125,150,2018-03-15
"3/16/2018",143,143,0,0,0,140,132,0,0,0,142,142,0,0,0,144,144,0,0,0,162,156,0,0,0,125,150,104,188,0,0,0,125,150,2018-03-16
"3/19/2018",143,143,0,0,0,140,135,0,0,0,142,142,0,0,0,144,144,0,0,0,162,156,0,0,0,125,150,92,174,0,0,0,125,150,2018-03-19
"3/20/2018",144,143,0,0,0,140,135,0,0,0,143,142,0,0,0,147,145,0,0,0,162,156,0,0,0,125,150,91,178,0,0,0,125,150,2018-03-20
"3/21/2018",144,143,0,0,0,140,135,0,0,0,143,143,0,0,0,146,145,0,0,0,155,152,0,0,0,125,150,93,184,0,0,0,125,150,2018-03-21
"3/22/2018",168,168,0,0,0,165,155,0,0,0,168,167,0,0,0,169,169,0,0,0,181,205,0,0,0,150,175,78,163,0,0,0,150,175,2018-03-22
"3/23/2018",168,168,0,0,0,165,70,0,0,0,168,167,0,0,0,170,169,0,0,0,181,180,0,0,0,150,175,78,158,0,0,0,150,175,2018-03-23
"3/26/2018",168,168,0,0,0,165,140,0,0,0,168,167,0,0,0,169,169,0,0,0,181,180,0,0,0,150,175,83,162,0,0,0,150,175,2018-03-26
"3/27/2018",168,168,0,0,0,165,158,0,0,0,168,168,0,0,0,169,169,0,0,0,181,180,0,0,0,150,175,81,168,0,0,0,150,175,2018-03-27
"3/28/2018",168,168,0,0,0,165,156,0,0,0,168,167,0,0,0,169,169,0,0,0,181,177,0,0,0,150,175,87,169,0,0,0,150,175,2018-03-28
"3/29/2018",168,168,0,0,0,164,140,0,0,0,168,168,0,0,0,169,169,0,0,0,181,180,0,0,0,150,175,74,102,0,0,0,0,175,2018-03-29
"3/30/2018",167,167,0,0,0,164,140,0,0,0,167,167,0,0,0,168,169,0,0,0,181,181,0,0,0,150,175,88,104,0,0,0,0,175,2018-03-30
"4/2/2018",168,168,177,177,180,165,140,115,115,125,168,168,175,176,177,169,169,177,177,189,181,180,185,210,225,150,175,89,160,329,361,849,150,175,2018-04-02
"4/3/2018",169,168,181,181,183,165,122,150,150,162,168,168,180,180,181,169,169,182,182,191,180,177,184,197,200,150,175,90,177,321,344,825,150,175,2018-04-03
"4/4/2018",169,169,170,170,174,165,155,157,157,165,168,168,169,170,170,170,170,170,170,179,180,180,174,181,184,150,175,83,176,327,348,859,150,175,2018-04-04
"4/5/2018",169,169,170,170,175,165,140,160,160,165,168,168,170,170,170,170,170,170,170,181,181,180,175,185,185,150,175,88,173,331,349,829,150,175,2018-04-05
"4/6/2018",169,169,170,170,175,165,115,160,160,165,168,168,170,170,170,170,170,170,170,180,181,180,175,183,184,150,175,78,154,336,352,845,150,175,2018-04-06
"4/9/2018",169,169,170,170,175,166,115,160,160,165,168,168,170,170,170,170,170,170,170,180,181,180,175,185,185,150,175,78,153,330,341,833,150,175,2018-04-09
"4/10/2018",169,169,170,170,175,166,115,160,160,166,168,168,170,170,170,170,170,171,171,180,180,178,175,184,184,150,175,80,155,325,336,811,150,175,2018-04-10
"4/11/2018",169,169,170,170,176,166,140,160,160,165,168,168,170,170,170,170,170,171,171,180,180,177,175,183,183,150,175,74,156,331,343,811,150,175,2018-04-11
"4/12/2018",169,169,168,168,173,165,158,159,159,164,168,168,167,167,168,170,170,168,168,177,180,180,173,179,180,150,175,83,160,335,345,871,150,175,2018-04-12
"4/13/2018",169,169,168,168,172,166,140,162,162,164,168,168,167,168,168,170,170,168,168,177,181,180,173,180,182,150,175,74,144,333,346,776,150,175,2018-04-13
"4/16/2018",169,169,170,170,177,166,160,162,163,165,168,168,170,170,170,170,170,171,171,182,185,181,175,184,185,150,175,82,166,335,355,770,150,175,2018-04-16
"4/17/2018",169,169,170,170,176,166,90,166,166,167,169,168,170,170,170,171,170,171,171,181,182,180,175,183,185,150,175,66,143,331,341,729,150,175,2018-04-17
"4/18/2018",169,169,169,169,175,166,140,164,164,166,168,168,169,169,169,171,170,170,170,180,182,180,175,180,183,150,175,63,144,335,346,738,150,175,2018-04-18
"4/19/2018",169,169,167,167,173,166,140,159,159,164,169,168,166,166,167,171,170,167,167,176,181,180,173,180,181,150,175,75,148,330,344,745,150,175,2018-04-19
"4/20/2018",170,169,167,167,172,166,115,159,159,164,169,168,167,167,167,171,170,167,167,176,182,180,173,177,179,150,175,72,154,328,340,726,150,175,2018-04-20
"4/23/2018",170,169,167,167,170,166,90,140,150,163,169,168,167,167,167,171,170,167,167,175,185,181,172,176,179,150,175,67,152,331,348,755,150,175,2018-04-23
"4/24/2018",170,169,168,168,171,166,70,160,160,164,169,168,168,168,168,172,171,168,168,176,185,181,173,178,180,150,175,63,149,325,339,747,150,175,2018-04-24
"4/25/2018",170,169,167,167,171,166,160,150,150,163,169,168,166,166,167,172,171,167,167,176,185,180,172,177,179,150,175,71,146,329,345,728,150,175,2018-04-25
"4/26/2018",170,169,167,167,172,166,140,160,160,164,169,168,167,167,167,172,171,168,168,177,181,180,172,178,180,150,175,77,155,321,333,725,150,175,2018-04-26
"4/27/2018",170,169,168,168,172,166,140,160,160,163,169,168,167,167,168,171,170,168,168,177,181,180,172,177,180,150,175,77,158,326,341,732,150,175,2018-04-27
"4/30/2018",169,169,171,172,177,166,156,150,150,166,168,168,171,171,172,170,170,172,172,182,184,181,176,183,186,150,175,76,163,325,341,775,150,175,2018-04-30
"5/1/2018",170,169,170,170,176,166,140,140,140,165,169,168,170,170,170,170,170,171,171,180,181,180,174,181,184,150,175,81,151,334,352,761,150,175,2018-05-01
"5/2/2018",170,169,170,170,175,166,140,160,160,164,169,168,170,170,170,171,170,170,170,179,181,180,174,180,183,150,175,76,161,334,350,753,150,175,2018-05-02
"5/3/2018",170,169,170,170,174,166,140,155,157,164,169,169,170,170,170,171,171,170,170,179,181,180,173,180,183,150,175,82,162,329,342,759,150,175,2018-05-03
"5/4/2018",170,170,168,168,172,166,140,162,162,165,169,169,168,168,168,171,171,168,169,177,181,180,172,178,180,150,175,83,160,333,349,752,150,175,2018-05-04
"5/7/2018",170,170,167,167,171,166,140,160,160,165,169,169,167,167,167,172,171,168,168,176,181,180,172,176,184,150,175,85,173,333,347,760,150,175,2018-05-07
"5/8/2018",170,170,168,168,172,166,140,161,161,165,169,169,167,167,168,172,171,168,168,177,181,180,175,179,181,150,175,83,169,330,342,746,150,175,2018-05-08
"5/9/2018",170,170,168,168,172,166,140,155,155,164,169,169,168,168,168,172,171,168,168,177,181,180,175,178,182,150,175,89,169,333,354,783,150,175,2018-05-09
"5/10/2018",170,170,169,169,173,166,140,155,155,164,169,168,169,169,169,172,171,169,170,179,181,180,175,179,183,150,175,89,173,342,357,737,150,175,2018-05-10
"5/11/2018",170,170,170,170,173,166,140,155,155,163,169,169,170,170,170,172,171,170,170,179,181,180,177,181,183,150,175,88,171,339,359,746,150,175,2018-05-11
"5/14/2018",170,170,170,170,175,166,140,160,160,165,169,169,169,169,170,172,171,170,170,179,181,180,176,180,182,150,175,79,161,334,353,741,150,175,2018-05-14
"5/15/2018",170,170,173,173,179,166,140,140,150,165,169,169,173,173,173,172,171,174,174,184,181,180,178,185,188,150,175,83,160,341,362,770,150,175,2018-05-15
"5/16/2018",170,170,170,170,175,165,140,163,163,165,169,169,170,170,170,172,171,170,170,179,180,180,176,180,182,150,175,85,160,333,350,754,150,175,2018-05-16
"5/17/2018",170,170,171,171,174,166,140,155,155,166,169,169,171,171,171,172,171,172,172,180,181,180,177,181,184,150,175,80,157,351,366,754,150,175,2018-05-17
"5/18/2018",170,170,169,169,173,166,140,160,160,165,169,169,169,169,169,172,172,169,170,177,181,180,176,177,181,150,175,78,153,349,371,750,150,175,2018-05-18
"5/21/2018",170,170,166,166,169,166,140,160,161,163,170,169,165,165,166,172,172,167,167,173,187,181,171,174,177,150,175,80,160,345,371,772,150,175,2018-05-21
"5/22/2018",170,170,163,163,165,166,160,155,155,159,170,169,162,162,163,172,171,163,163,169,181,180,170,170,175,150,175,89,167,337,359,748,150,175,2018-05-22
"5/23/2018",170,170,163,163,167,166,163,159,159,160,169,169,163,163,163,171,171,163,164,170,183,183,172,179,180,150,175,92,167,339,356,729,150,175,2018-05-23
"5/24/2018",170,170,171,171,174,165,70,165,165,166,169,169,171,171,171,170,171,171,171,179,181,180,179,182,184,150,175,90,168,350,361,772,150,175,2018-05-24
"5/25/2018",170,170,170,170,173,165,140,163,163,165,169,169,170,170,170,171,171,170,170,178,181,180,175,181,182,150,175,92,167,351,367,749,150,175,2018-05-25
"5/29/2018",170,170,170,170,172,166,158,165,165,167,169,169,170,170,170,170,171,170,170,178,184,181,175,180,182,150,175,89,163,355,365,796,150,175,2018-05-29
"5/30/2018",170,170,170,170,172,165,155,165,165,167,169,169,170,170,170,171,171,170,170,178,183,180,176,180,181,150,175,83,153,368,374,801,150,175,2018-05-30
"5/31/2018",170,170,178,178,181,166,140,172,172,173,169,169,177,177,178,170,170,178,178,188,184,180,184,210,205,150,175,84,155,372,392,872,150,175,2018-05-31
"6/1/2018",170,170,177,177,181,166,140,170,170,171,169,169,177,177,177,170,171,177,177,186,181,180,182,189,192,150,175,94,162,380,386,807,150,175,2018-06-01
"6/4/2018",170,170,176,176,180,165,140,165,165,168,169,169,176,176,176,170,170,176,176,184,180,180,180,187,188,150,175,92,168,371,385,825,150,175,2018-06-04
"6/5/2018",170,170,172,172,175,166,140,165,165,167,169,169,172,172,172,170,170,172,172,180,180,180,176,181,183,150,175,90,168,378,385,797,150,175,2018-06-05
"6/6/2018",170,170,170,170,173,166,155,165,165,165,169,169,169,169,170,170,171,171,171,177,180,178,174,178,180,150,175,94,176,382,389,805,150,175,2018-06-06
"6/7/2018",170,170,169,169,171,165,135,162,162,165,169,169,169,169,169,170,170,170,170,176,180,180,173,178,180,150,175,87,162,373,385,813,150,175,2018-06-07
"6/8/2018",170,170,167,167,169,166,155,161,162,164,169,169,167,167,167,170,170,167,167,174,180,180,171,176,177,150,175,90,165,372,386,806,150,175,2018-06-08
"6/11/2018",170,170,166,166,169,166,145,160,160,160,169,169,166,166,166,171,171,167,167,173,181,180,172,175,176,150,175,75,146,356,372,791,150,175,2018-06-11
"6/12/2018",170,170,165,165,167,166,140,161,161,162,170,169,164,164,165,171,171,165,165,172,180,178,170,178,178,150,175,81,166,380,393,774,150,175,2018-06-12
"6/13/2018",170,170,168,168,171,166,150,160,160,162,169,169,168,168,168,171,171,168,168,175,180,180,172,180,180,150,175,80,163,376,388,817,150,175,2018-06-13
"6/14/2018",190,190,187,187,190,188,160,176,176,180,189,189,187,187,187,191,191,187,187,194,200,202,191,197,199,175,200,80,163,369,382,818,175,195,2018-06-14
"6/15/2018",190,190,187,187,191,188,160,182,182,184,190,189,187,187,187,191,191,188,188,196,201,202,193,205,205,175,200,69,148,366,386,802,175,195,2018-06-15
"6/18/2018",190,190,185,185,190,188,160,180,180,182,190,189,185,185,185,191,191,186,186,193,206,202,190,195,198,175,200,61,135,364,376,799,175,195,2018-06-18
"6/19/2018",191,190,184,184,188,188,160,179,179,181,190,189,184,184,184,193,192,185,185,192,206,202,190,194,196,175,200,59,135,361,373,799,175,195,2018-06-19
"6/20/2018",192,191,183,183,187,189,175,177,177,180,190,190,183,183,183,194,193,184,184,191,206,202,191,194,194,175,200,63,145,359,375,769,175,195,2018-06-20
"6/21/2018",192,191,183,183,187,188,180,178,178,180,191,190,183,183,183,194,192,184,184,191,206,202,191,199,200,175,200,81,157,349,363,753,175,195,2018-06-21
"6/22/2018",192,191,190,190,192,189,85,180,180,183,191,190,190,190,190,193,192,190,190,196,206,202,193,200,201,175,200,78,161,350,361,742,175,195,2018-06-22
"6/25/2018",192,191,189,189,191,190,180,176,176,180,191,190,188,188,189,192,192,189,189,195,206,202,194,197,201,175,200,76,156,353,364,755,175,195,2018-06-25
"6/26/2018",192,191,189,189,190,190,179,175,175,180,191,190,188,188,189,192,192,190,190,195,206,202,192,198,199,175,200,82,158,345,354,757,175,195,2018-06-26
"6/27/2018",191,191,188,188,190,190,175,180,180,183,191,190,188,188,188,192,192,189,189,195,206,202,192,197,199,175,200,83,162,343,355,760,175,195,2018-06-27
"6/28/2018",191,191,190,190,193,190,183,180,180,185,190,190,190,190,190,192,192,191,191,197,206,202,195,215,215,175,200,79,159,341,364,768,175,195,2018-06-28
"6/29/2018",191,190,210,210,212,188,175,160,160,180,190,189,210,210,210,191,191,210,210,222,206,202,215,235,237,175,200,79,152,300,322,702,175,195,2018-06-29
"7/2/2018",191,191,200,200,204,189,160,177,180,193,190,190,200,200,201,192,192,201,202,210,206,202,205,213,215,175,200,83,155,310,337,775,175,195,2018-07-02
"7/3/2018",191,191,197,198,200,188,179,180,180,185,190,190,197,197,198,191,191,198,198,206,206,202,201,208,210,175,200,88,165,329,356,768,175,195,2018-07-03
"7/5/2018",191,191,195,195,197,188,179,183,183,185,190,190,195,195,195,191,191,195,195,203,206,202,198,203,207,175,200,78,159,346,366,807,175,195,2018-07-05
"7/6/2018",191,191,190,190,193,188,175,181,181,185,190,190,190,190,190,191,191,190,191,198,205,202,193,199,202,175,200,80,157,350,367,760,175,195,2018-07-06
"7/9/2018",191,191,187,187,189,189,180,182,182,184,191,190,187,187,187,191,191,187,187,194,206,202,191,195,197,175,200,77,159,377,389,784,175,195,2018-07-09
"7/10/2018",191,191,187,187,189,189,179,182,182,183,191,190,186,186,187,191,191,187,187,194,206,202,191,200,200,175,200,80,167,362,381,762,175,195,2018-07-10
"7/11/2018",191,191,186,186,189,190,179,182,182,183,190,190,186,186,186,191,191,187,187,193,206,202,191,195,196,175,200,82,163,363,377,766,175,195,2018-07-11
"7/12/2018",191,191,187,187,190,188,165,182,182,184,190,190,186,186,187,191,191,187,187,194,206,202,191,196,198,175,200,84,167,354,366,747,175,195,2018-07-12
"7/13/2018",191,191,187,187,190,190,160,182,182,184,191,190,187,187,187,191,191,188,188,195,206,202,192,205,205,175,200,79,156,358,372,735,175,195,2018-07-13
"7/16/2018",191,191,192,192,195,190,160,186,186,187,191,190,192,192,192,192,191,192,192,200,205,202,195,203,205,175,200,80,160,384,398,767,175,195,2018-07-16
"7/17/2018",191,191,190,191,192,189,160,185,185,186,191,190,190,190,190,191,191,191,191,198,206,202,194,200,202,175,200,78,157,380,392,766,175,195,2018-07-17
"7/18/2018",191,191,187,187,190,190,170,182,182,183,191,190,187,187,187,192,191,187,187,195,200,202,192,195,198,175,200,78,168,376,389,783,175,195,2018-07-18
"7/19/2018",191,191,188,188,190,190,160,182,182,184,191,190,188,188,188,192,191,188,188,196,206,202,192,197,199,175,200,72,161,375,388,769,175,195,2018-07-19
"7/20/2018",191,191,186,186,188,190,170,181,181,184,190,190,186,186,186,192,191,186,186,194,206,202,191,195,197,175,200,77,162,379,395,773,175,195,2018-07-20
"7/23/2018",191,191,186,186,187,190,160,180,180,184,191,190,186,186,186,192,191,186,186,193,206,202,191,195,197,175,200,71,162,381,392,764,175,195,2018-07-23
"7/24/2018",191,191,189,189,190,190,85,181,179,182,191,190,189,189,189,192,191,190,190,195,206,202,192,199,200,175,200,74,164,371,382,775,175,195,2018-07-24
"7/25/2018",191,191,186,186,187,190,180,182,182,183,191,190,186,186,186,192,191,186,186,193,206,202,191,197,198,175,200,77,164,388,404,753,175,195,2018-07-25
"7/26/2018",191,191,189,189,190,190,174,183,183,185,191,190,189,189,189,192,191,190,190,196,206,202,193,199,200,175,200,74,157,376,387,784,175,195,2018-07-26
"7/27/2018",191,191,187,187,188,190,180,180,180,183,190,190,187,187,187,192,191,187,187,194,206,202,191,196,198,175,200,79,162,378,393,774,175,195,2018-07-27
"7/30/2018",191,191,186,186,188,190,160,180,180,182,191,190,186,186,186,191,191,187,187,193,206,202,191,195,197,175,200,74,161,380,391,768,175,195,2018-07-30
"7/31/2018",191,190,191,191,193,189,160,182,182,185,190,190,191,191,191,191,191,191,192,198,206,202,195,200,203,175,200,67,151,386,400,799,175,195,2018-07-31
"8/1/2018",191,190,186,186,188,190,175,181,181,183,190,190,185,185,186,191,191,186,186,193,206,202,191,197,200,175,200,77,159,384,396,786,175,195,2018-08-01
"8/2/2018",191,191,190,190,191,190,179,180,180,184,190,190,190,190,190,192,191,190,190,196,206,205,194,200,201,175,200,80,161,381,392,781,175,195,2018-08-02
"8/3/2018",191,190,183,183,186,190,160,180,180,181,190,190,183,183,183,191,191,183,184,191,206,202,193,200,202,175,200,83,164,384,403,763,175,195,2018-08-03
"8/6/2018",191,191,184,184,186,190,160,180,180,182,191,190,184,184,184,192,191,184,184,192,201,202,190,196,200,175,200,76,167,384,399,763,175,195,2018-08-06
"8/7/2018",191,191,186,186,187,190,160,181,182,184,191,190,186,186,186,192,191,187,187,193,206,202,192,197,197,175,200,68,160,373,387,732,175,195,2018-08-07
"8/8/2018",191,191,187,187,188,190,175,182,182,184,191,190,187,187,187,192,191,187,188,194,200,202,193,197,198,175,200,70,161,378,391,738,175,195,2018-08-08
"8/9/2018",191,191,190,190,191,190,160,184,184,185,191,190,190,190,190,192,192,190,190,197,206,202,194,200,201,175,200,73,155,384,402,761,175,195,2018-08-09
"8/10/2018",191,191,187,187,190,190,175,183,183,185,191,190,187,187,187,191,191,188,188,195,206,202,193,205,205,175,200,82,166,380,399,735,175,195,2018-08-10
"8/13/2018",191,191,189,189,191,190,160,185,185,185,191,190,189,189,189,192,192,189,189,196,206,202,193,202,204,175,200,73,151,382,396,733,175,195,2018-08-13
"8/14/2018",191,191,191,191,193,189,160,185,185,187,191,190,190,190,191,192,192,191,191,198,206,202,194,206,206,175,200,68,135,382,398,729,175,195,2018-08-14
"8/15/2018",191,191,197,197,198,190,160,185,185,190,191,190,196,197,197,192,192,197,197,204,200,202,200,210,210,175,200,66,141,399,417,807,175,195,2018-08-15
"8/16/2018",192,191,198,198,199,190,175,186,186,191,191,190,197,198,198,193,193,198,198,205,207,202,201,208,209,175,200,64,134,406,417,782,175,195,2018-08-16
"8/17/2018",192,191,190,190,190,190,160,185,185,186,191,190,189,189,190,193,193,190,190,196,207,202,193,197,201,175,200,55,127,397,413,799,175,195,2018-08-17
"8/20/2018",192,191,189,189,190,190,160,184,184,185,191,190,188,188,189,193,192,189,189,195,210,206,193,198,199,175,200,56,126,398,413,778,175,195,2018-08-20
"8/21/2018",192,191,188,188,190,190,160,182,182,185,191,190,188,188,188,193,193,189,189,195,206,202,192,198,200,175,200,59,130,403,415,772,175,195,2018-08-21
"8/22/2018",192,191,189,189,190,190,160,184,184,185,191,190,189,189,189,193,193,189,189,196,206,202,193,201,203,175,200,64,138,404,417,787,175,195,2018-08-22
"8/23/2018",192,191,192,192,194,189,160,185,185,187,191,190,192,192,192,193,193,193,193,200,206,203,196,205,205,175,200,68,135,403,420,773,175,195,2018-08-23
"8/24/2018",192,191,194,194,195,190,160,184,184,189,191,190,194,194,194,193,193,194,194,201,206,202,197,204,205,175,200,71,131,407,427,773,175,195,2018-08-24
"8/27/2018",192,191,194,194,195,190,160,184,184,189,191,190,194,194,194,193,193,195,195,202,206,203,198,205,207,175,200,69,133,414,441,814,175,195,2018-08-27
"8/28/2018",192,191,194,194,195,190,160,184,184,187,191,190,194,194,194,193,193,195,195,202,206,202,198,205,206,175,200,64,137,410,434,805,175,195,2018-08-28
"8/29/2018",192,191,192,192,193,190,160,185,185,186,191,191,192,192,192,193,193,193,193,199,200,202,196,201,203,175,200,65,133,407,422,797,175,195,2018-08-29
"8/30/2018",192,191,192,192,193,190,160,182,182,186,191,191,192,192,192,193,193,193,193,200,206,205,196,202,205,175,200,69,137,403,416,795,175,195,2018-08-30
"8/31/2018",191,191,195,195,197,188,160,185,185,190,191,190,195,195,195,193,192,195,195,203,206,203,199,205,208,175,200,78,146,410,428,804,175,195,2018-08-31
"9/4/2018",192,191,193,193,195,190,160,185,185,188,191,191,192,192,193,193,193,193,193,201,206,202,196,204,205,175,200,73,137,412,427,833,175,195,2018-09-04
"9/5/2018",192,191,193,193,195,190,180,184,184,188,191,191,192,192,193,193,192,193,193,200,206,202,196,202,204,175,200,78,147,414,429,798,175,195,2018-09-05
"9/6/2018",192,191,191,191,194,190,160,185,185,188,191,191,191,191,191,193,193,191,191,199,206,203,196,203,204,175,200,76,142,414,432,799,175,195,2018-09-06
"9/7/2018",192,191,191,191,194,190,160,185,185,188,191,190,191,191,191,192,192,191,191,199,206,202,196,204,204,175,200,78,144,411,428,802,175,195,2018-09-07
"9/10/2018",192,191,192,192,194,190,160,185,185,186,191,191,191,191,192,193,193,192,192,199,206,202,196,202,203,175,200,74,139,419,432,816,175,195,2018-09-10
"9/11/2018",192,191,192,192,194,189,160,185,185,185,191,190,192,192,192,193,193,192,192,199,206,203,196,202,204,175,200,75,147,416,431,802,175,195,2018-09-11
"9/12/2018",192,192,192,192,194,190,160,180,180,185,191,191,192,192,192,193,193,192,192,199,206,203,196,203,203,175,200,75,146,419,434,810,175,195,2018-09-12
"9/13/2018",192,191,191,191,194,190,180,185,185,187,191,191,191,191,191,192,192,191,192,199,206,203,195,200,202,175,200,76,140,417,440,810,175,195,2018-09-13
"9/14/2018",192,191,191,191,195,190,160,185,185,188,191,190,191,191,191,192,192,192,192,199,206,206,195,207,207,175,200,68,132,398,431,798,175,195,2018-09-14
"9/17/2018",192,191,197,197,200,190,160,186,186,190,191,191,197,197,197,193,193,197,197,205,209,206,200,207,210,175,200,62,118,391,410,789,175,195,2018-09-17
"9/18/2018",192,191,191,191,194,190,160,183,183,186,191,191,191,191,191,193,193,192,192,199,210,206,195,200,202,175,200,54,125,412,424,819,175,195,2018-09-18
"9/19/2018",192,192,190,190,192,190,172,184,184,187,191,191,190,190,190,193,193,190,190,197,210,206,194,200,201,175,200,60,133,415,430,794,175,195,2018-09-19
"9/20/2018",192,192,190,190,192,190,160,180,180,185,191,191,190,190,190,193,193,191,191,198,210,206,195,199,201,175,200,69,137,403,415,808,175,195,2018-09-20
"9/21/2018",192,192,190,190,192,189,160,184,184,187,192,191,190,190,190,193,193,190,190,197,210,206,195,199,201,175,200,69,138,406,417,781,175,195,2018-09-21
"9/24/2018",193,192,194,194,195,190,170,188,183,188,192,191,194,194,194,193,193,194,194,201,207,206,197,204,205,175,200,68,142,392,404,799,175,195,2018-09-24
"9/25/2018",193,192,191,191,193,190,160,183,183,185,192,191,191,191,191,193,193,191,191,198,210,205,195,200,202,175,200,67,150,391,408,814,175,195,2018-09-25
"9/26/2018",193,192,191,191,192,190,160,180,180,185,192,191,191,191,191,193,193,191,191,198,206,205,195,200,201,175,200,71,144,398,415,828,175,195,2018-09-26
"9/27/2018",218,217,215,215,216,193,185,201,201,210,217,216,214,214,215,218,218,215,215,222,235,230,218,224,226,200,225,76,144,388,402,825,200,220,2018-09-27
"9/28/2018",218,217,224,224,225,213,185,200,200,210,217,216,223,223,224,218,218,224,225,233,235,235,226,235,240,200,225,70,145,354,372,807,200,220,2018-09-28
"10/1/2018",218,217,220,220,222,215,185,205,205,215,217,216,219,219,220,218,218,220,220,228,235,235,224,230,233,200,225,55,131,395,416,917,200,220,2018-10-01
"10/2/2018",218,217,218,218,220,216,185,210,210,215,217,216,218,218,219,218,218,219,219,227,235,235,223,229,230,200,225,62,133,400,419,861,200,220,2018-10-02
"10/3/2018",218,217,218,218,220,216,185,211,213,214,217,216,218,218,218,219,219,218,218,226,235,231,223,228,230,200,225,67,133,413,427,855,200,220,2018-10-03
"10/4/2018",218,218,217,217,218,215,185,211,211,214,217,216,216,217,217,219,218,217,217,224,235,232,221,225,228,200,225,73,132,405,420,816,200,220,2018-10-04
"10/5/2018",218,218,214,214,216,216,185,210,210,212,217,216,214,214,214,219,219,214,214,222,235,235,220,224,227,200,225,64,123,413,429,873,200,220,2018-10-05
"10/9/2018",218,218,213,213,215,216,140,200,200,210,217,216,213,213,213,219,218,213,213,221,235,235,218,227,227,200,225,57,127,415,434,855,200,220,2018-10-09
"10/10/2018",218,218,214,214,215,216,185,205,205,211,217,217,214,214,214,219,219,214,214,222,235,227,220,227,227,200,225,64,133,409,431,839,200,220,2018-10-10
"10/11/2018",218,218,216,216,217,216,185,195,195,211,217,217,215,215,216,219,219,216,216,224,235,235,221,227,228,200,225,66,135,411,430,838,200,220,2018-10-11
"10/12/2018",218,218,216,216,218,216,185,211,211,214,217,217,216,216,216,219,218,216,216,225,235,235,222,227,228,200,225,69,129,409,435,852,200,220,2018-10-12
"10/15/2018",218,218,219,219,221,216,180,200,200,215,217,217,219,219,219,219,219,220,220,227,235,235,224,229,231,200,225,58,119,408,423,837,200,220,2018-10-15
"10/16/2018",218,218,217,217,218,216,185,205,205,213,217,217,217,217,217,219,219,218,218,225,235,235,222,227,229,200,225,59,120,411,424,816,200,220,2018-10-16
"10/17/2018",219,218,217,217,218,217,185,210,211,214,218,217,217,217,217,219,219,217,217,225,235,235,222,228,229,200,225,54,125,404,417,771,200,220,2018-10-17
"10/18/2018",219,218,218,218,219,215,180,211,212,215,218,217,218,218,218,219,219,218,218,226,235,234,223,227,230,200,225,54,123,399,415,810,200,220,2018-10-18
"10/19/2018",219,218,217,217,219,215,180,212,212,215,218,217,217,217,217,219,219,217,217,225,235,235,222,227,230,200,225,58,121,398,413,785,200,220,2018-10-19
"10/22/2018",219,218,217,217,218,217,185,206,206,213,218,217,217,217,217,219,219,217,217,224,235,235,221,226,229,200,225,54,127,393,408,791,200,220,2018-10-22
"10/23/2018",220,218,215,215,217,217,185,210,210,213,218,218,215,215,215,220,220,215,215,223,235,235,220,224,228,200,225,58,132,392,408,779,200,220,2018-10-23
"10/24/2018",220,218,216,216,218,217,205,210,210,212,218,217,216,216,216,220,220,217,217,224,235,235,221,226,229,200,225,60,137,399,420,828,200,220,2018-10-24
"10/25/2018",220,219,217,217,219,217,185,210,212,214,218,218,217,217,217,220,220,217,217,225,235,235,222,227,230,200,225,67,135,395,425,822,200,220,2018-10-25
"10/26/2018",220,219,217,217,219,217,195,212,212,214,219,218,217,217,217,220,220,217,217,225,235,235,221,227,230,200,225,64,140,395,413,779,200,220,2018-10-26
"10/29/2018",220,219,217,217,218,217,185,207,210,212,219,218,217,217,217,220,220,217,217,224,235,235,222,227,230,200,225,59,138,393,412,806,200,220,2018-10-29
"10/30/2018",220,219,217,217,218,215,205,210,210,214,219,218,217,217,217,220,220,217,217,224,235,235,221,225,229,200,225,60,137,396,412,788,200,220,2018-10-30
"10/31/2018",220,219,219,219,222,215,185,208,208,215,219,218,219,219,219,220,220,220,220,228,235,235,225,235,235,200,225,58,135,403,427,849,200,220,2018-10-31
"11/1/2018",220,219,220,220,222,216,185,210,210,216,219,218,220,220,220,220,220,221,221,229,235,235,225,247,245,200,225,68,140,411,434,835,200,220,2018-11-01
"11/2/2018",219,219,224,224,225,217,205,215,215,220,219,218,224,224,224,220,220,224,224,232,235,235,229,237,238,200,225,74,154,416,437,853,200,220,2018-11-02
"11/5/2018",220,219,223,223,224,216,185,210,210,215,219,218,223,223,223,220,220,223,223,230,235,235,227,233,236,200,225,70,148,418,436,842,200,220,2018-11-05
"11/6/2018",220,219,222,222,222,216,185,210,210,210,219,218,221,221,222,220,220,222,222,228,235,235,225,230,234,200,225,71,149,420,437,802,200,220,2018-11-06
"11/7/2018",220,219,216,216,218,216,205,210,210,212,219,218,216,216,216,220,220,217,217,223,235,235,221,224,229,200,225,67,150,410,424,823,200,220,2018-11-07
"11/8/2018",220,219,220,220,221,215,185,206,207,216,219,218,220,220,220,220,220,220,220,227,235,235,225,229,233,200,225,64,137,413,439,819,200,220,2018-11-08
"11/9/2018",219,219,219,219,220,217,207,212,212,214,219,218,218,218,219,220,220,219,219,226,235,235,224,228,232,200,225,66,137,410,436,836,200,220,2018-11-09
"11/13/2018",220,219,217,217,220,217,140,200,200,213,219,218,217,217,217,220,220,217,217,225,235,235,222,226,230,200,225,60,126,405,431,817,200,220,2018-11-13
"11/14/2018",220,219,217,217,220,217,205,212,212,215,219,218,217,217,217,220,220,217,217,225,235,235,222,229,230,200,225,62,138,415,440,803,200,220,2018-11-14
"11/15/2018",220,219,226,226,228,218,185,212,212,220,219,218,225,225,226,220,220,226,226,234,235,235,230,237,239,200,225,60,131,413,436,846,200,220,2018-11-15
"11/16/2018",220,219,225,225,226,217,185,216,217,220,219,218,225,225,225,220,220,226,226,232,235,235,230,234,238,200,225,69,137,422,442,828,200,220,2018-11-16
"11/19/2018",220,219,222,222,224,217,185,215,215,217,219,218,222,222,222,220,220,222,223,229,235,235,226,231,236,200,225,67,148,413,436,863,200,220,2018-11-19
"11/20/2018",220,219,218,218,220,217,185,210,210,214,219,218,218,218,218,220,220,219,219,226,235,235,223,227,231,200,225,61,140,407,427,845,200,220,2018-11-20
"11/21/2018",220,219,217,217,218,217,208,213,213,215,219,218,217,217,217,220,220,217,217,224,235,235,222,226,231,200,225,59,124,401,406,819,200,220,2018-11-21
"11/23/2018",220,219,222,222,223,216,210,215,215,217,219,218,222,222,222,220,220,222,223,230,235,235,226,232,236,200,225,65,129,402,414,820,200,220,2018-11-23
"11/26/2018",220,219,218,218,220,216,208,213,213,216,219,218,218,218,218,220,220,219,219,226,235,235,223,227,232,200,225,62,142,410,433,862,200,220,2018-11-26
"11/27/2018",220,219,217,217,219,216,208,212,212,216,219,218,217,217,217,220,220,218,218,225,235,235,223,228,231,200,225,57,132,411,434,843,200,220,2018-11-27
"11/28/2018",220,219,219,219,219,216,203,213,213,216,219,218,218,218,219,220,220,219,219,226,235,235,223,228,232,200,225,65,132,410,429,850,200,220,2018-11-28
"11/29/2018",220,219,223,223,224,217,208,210,212,218,219,218,223,223,223,220,220,223,223,231,235,235,227,234,236,200,225,69,134,402,427,850,200,220,2018-11-29
"11/30/2018",220,219,227,227,228,217,208,216,216,223,219,218,227,227,227,220,220,228,228,236,235,235,231,237,242,200,225,75,146,407,423,919,200,220,2018-11-30
"12/3/2018",219,219,222,222,223,217,208,217,218,220,219,218,222,222,222,220,220,223,223,230,235,235,226,231,240,200,225,83,149,416,435,912,200,220,2018-12-03
"12/4/2018",220,219,223,223,227,217,153,220,220,221,219,219,223,223,223,220,220,223,223,232,235,235,240,285,285,200,225,78,120,421,455,892,0,220,2018-12-04
"12/5/2018",220,219,0,0,0,217,203,0,0,0,219,218,0,0,0,220,220,0,0,0,235,235,0,0,0,200,225,66,105,0,0,0,0,220,2018-12-05
"12/6/2018",220,219,231,231,234,217,208,210,210,215,219,218,231,231,231,220,220,232,232,240,235,235,235,255,270,200,225,71,140,411,447,963,200,220,2018-12-06
"12/7/2018",219,219,228,228,230,217,208,210,210,210,219,217,228,228,228,220,220,228,228,236,235,235,232,238,242,200,225,73,147,415,432,912,200,220,2018-12-07
"12/10/2018",220,219,220,220,222,217,208,210,211,215,219,218,220,220,220,220,220,221,221,228,235,235,225,229,233,200,225,70,151,412,425,903,200,220,2018-12-10
"12/11/2018",219,219,217,217,219,217,209,211,211,214,219,218,216,216,217,220,220,217,217,224,235,235,221,230,230,200,225,72,152,419,435,868,200,220,2018-12-11
"12/12/2018",219,219,217,217,220,217,209,212,212,215,219,218,217,217,217,220,220,217,217,225,235,235,222,227,230,200,225,74,155,408,424,882,200,220,2018-12-12
"12/13/2018",219,219,218,218,221,217,207,213,213,215,219,218,218,218,218,220,220,218,218,226,235,235,222,226,231,200,225,70,143,409,426,897,200,220,2018-12-13
"12/14/2018",219,219,219,219,221,217,208,213,214,215,219,218,219,219,219,220,220,220,220,227,235,235,223,230,232,200,225,64,122,406,425,867,200,220,2018-12-14
"12/17/2018",220,219,228,228,231,217,208,219,220,225,219,218,228,228,228,220,220,228,229,237,235,235,233,243,245,200,225,66,124,407,428,935,200,220,2018-12-17
"12/18/2018",220,219,230,230,232,217,208,205,205,215,219,218,230,230,230,220,220,231,231,239,235,235,234,241,245,200,225,61,127,405,421,920,200,220,2018-12-18
"12/19/2018",220,219,229,229,230,216,209,210,210,210,219,218,229,229,229,221,220,230,230,237,235,235,233,238,244,200,225,72,141,404,424,910,200,220,2018-12-19
"12/20/2018",240,240,240,240,241,237,229,230,230,235,239,238,239,239,240,241,240,240,240,248,260,260,243,250,254,225,250,50,123,401,418,963,225,240,2018-12-20
"12/21/2018",240,240,239,239,240,237,230,231,231,235,239,238,239,239,239,241,240,239,239,247,260,260,242,245,254,225,250,69,139,388,394,927,225,240,2018-12-21
"12/24/2018",240,240,241,241,241,237,230,235,235,238,239,238,240,240,241,241,240,241,241,249,260,260,246,251,255,225,250,69,127,378,385,881,225,240,2018-12-24
"12/26/2018",240,240,243,243,244,237,229,225,225,230,240,238,242,242,243,241,240,243,243,252,260,260,246,253,257,225,250,67,136,387,403,957,225,240,2018-12-26
"12/27/2018",240,240,243,243,244,234,230,230,230,230,239,238,242,242,243,241,240,243,243,252,260,260,246,252,257,225,250,71,154,383,390,943,225,240,2018-12-27
"12/28/2018",240,239,245,245,246,235,225,225,225,230,239,237,244,244,245,241,240,245,245,254,260,260,248,255,260,225,250,67,136,381,392,927,225,240,2018-12-28
"12/31/2018",240,240,295,295,300,225,215,230,230,270,240,236,291,293,295,241,241,295,295,320,260,260,320,625,625,225,250,55,102,386,409,1000,225,240,2018-12-31
"1/2/2019",240,240,310,310,315,236,229,230,230,230,240,238,305,305,310,241,240,310,310,329,260,260,315,350,370,225,250,56,116,419,452,1092,225,240,2019-01-02
"1/3/2019",240,240,270,270,270,234,229,230,230,230,240,238,268,268,270,241,240,270,270,278,260,260,273,278,289,225,250,62,136,429,444,1063,225,240,2019-01-03
"1/4/2019",240,240,243,243,245,237,229,230,230,230,240,238,242,243,243,241,240,243,243,251,260,260,247,251,260,225,250,68,143,433,449,1041,225,240,2019-01-04
"1/7/2019",240,240,238,238,241,234,229,232,232,235,240,238,238,238,239,241,240,239,239,247,260,260,243,252,254,225,250,68,149,425,450,1052,225,240,2019-01-07
"1/8/2019",240,240,240,240,242,235,230,234,234,238,240,238,240,240,240,241,240,241,241,250,260,260,245,252,255,225,250,70,146,434,451,1070,225,240,2019-01-08
"1/9/2019",240,240,244,244,245,237,230,230,230,230,240,238,244,244,244,241,240,244,244,252,260,260,246,253,259,225,250,64,144,435,457,1032,225,240,2019-01-09
"1/10/2019",240,239,241,241,243,237,230,234,234,237,240,238,241,241,241,241,240,241,241,249,260,260,244,250,256,225,250,65,139,428,453,1026,225,240,2019-01-10
"1/11/2019",240,239,238,238,241,235,229,233,233,235,239,238,238,238,238,241,240,238,238,246,260,260,241,246,252,225,250,63,134,437,456,973,225,240,2019-01-11
"1/14/2019",240,239,238,238,240,237,229,231,231,234,240,238,238,238,238,241,240,238,238,246,260,260,242,246,253,225,250,59,135,433,447,977,225,240,2019-01-14
"1/15/2019",240,239,241,241,246,237,229,235,235,238,240,238,241,241,241,241,240,241,241,250,260,260,246,251,256,225,250,58,126,442,470,991,225,240,2019-01-15
"1/16/2019",240,240,237,237,243,236,227,232,232,235,240,238,237,237,237,241,240,237,237,246,260,260,241,246,252,225,250,63,135,435,473,988,225,240,2019-01-16
"1/17/2019",240,240,237,237,241,237,230,232,232,235,240,238,237,237,237,241,240,237,237,246,260,260,241,247,252,225,250,63,129,426,461,969,225,240,2019-01-17
"1/18/2019",240,240,237,237,242,235,227,232,232,234,240,238,237,237,237,241,240,237,237,246,260,260,241,246,252,225,250,58,125,426,455,974,225,240,2019-01-18
"1/22/2019",240,239,237,237,241,236,228,232,232,235,240,237,237,237,237,241,240,238,238,246,260,260,242,247,252,225,250,48,121,431,459,967,225,240,2019-01-22
"1/23/2019",240,239,238,238,240,236,230,232,232,235,240,238,237,237,238,241,240,238,238,246,260,260,241,247,252,225,250,55,133,433,456,956,225,240,2019-01-23
"1/24/2019",240,239,240,240,241,234,230,232,232,235,240,238,240,240,240,241,240,240,240,248,260,260,243,250,255,225,250,64,132,433,459,994,225,240,2019-01-24
"1/25/2019",240,239,238,238,240,237,230,233,233,234,239,238,238,238,238,241,240,238,238,246,260,260,241,246,253,225,250,69,137,436,459,915,225,240,2019-01-25
"1/28/2019",240,239,237,237,239,236,229,230,230,232,240,238,237,237,237,241,240,237,237,245,260,260,240,246,252,225,250,68,141,437,458,981,225,240,2019-01-28
"1/29/2019",240,239,237,237,240,236,227,230,230,232,240,238,237,237,237,241,240,237,237,245,260,260,240,246,252,225,250,60,128,438,457,934,225,240,2019-01-29
"1/30/2019",240,239,236,236,239,237,227,232,232,235,240,238,236,236,236,241,240,237,237,245,260,260,240,245,252,225,250,63,130,431,451,948,225,240,2019-01-30
"1/31/2019",240,240,255,255,258,236,229,230,230,230,240,238,255,255,255,241,240,256,257,265,260,260,259,274,285,225,250,66,122,453,484,1048,225,240,2019-01-31
"2/1/2019",240,240,244,244,247,234,229,230,230,230,240,238,244,244,244,240,240,245,245,252,260,260,249,254,259,225,250,76,138,464,494,993,225,240,2019-02-01
"2/4/2019",240,239,238,238,240,234,230,228,230,230,239,238,238,238,238,240,240,239,239,247,260,260,243,247,253,225,250,82,153,447,470,964,225,240,2019-02-04
"2/5/2019",240,239,237,237,240,235,230,232,232,234,239,238,236,236,237,240,240,237,237,245,260,260,241,246,251,225,250,83,147,438,464,932,225,240,2019-02-05
"2/6/2019",240,239,235,235,238,237,230,230,230,233,239,238,235,235,235,240,240,235,235,244,260,252,240,248,249,225,250,83,155,445,469,942,225,240,2019-02-06
"2/7/2019",240,239,236,236,238,237,230,230,231,234,239,238,236,236,236,240,240,236,236,245,260,260,241,245,251,225,250,78,147,440,464,918,225,240,2019-02-07
"2/8/2019",240,239,235,235,237,237,229,230,230,233,239,238,235,235,235,240,240,235,235,244,260,260,241,244,250,225,250,77,152,440,454,912,225,240,2019-02-08
"2/11/2019",240,240,240,240,240,237,229,232,232,235,240,238,239,239,240,241,240,240,240,248,260,260,245,248,256,225,250,65,134,442,454,984,225,240,2019-02-11
"2/12/2019",240,240,236,236,239,236,229,230,230,233,240,238,236,236,236,241,240,236,236,244,260,260,241,247,250,225,250,65,132,441,465,920,225,240,2019-02-12
"2/13/2019",240,240,236,236,238,234,229,231,231,234,240,238,236,236,236,241,240,236,236,244,260,260,241,246,250,225,250,65,131,438,459,928,225,240,2019-02-13
"2/14/2019",240,240,236,236,239,237,225,231,232,234,240,238,236,236,236,240,240,237,237,245,260,255,242,246,250,225,250,68,131,432,458,862,225,240,2019-02-14
"2/15/2019",240,240,241,241,243,237,225,235,236,238,240,238,241,241,241,241,240,242,242,249,260,260,244,250,256,225,250,56,125,440,461,913,225,240,2019-02-15
"2/19/2019",240,240,237,237,240,237,225,232,233,235,240,238,237,237,237,241,241,238,238,246,260,260,241,249,251,225,250,61,124,442,471,941,225,240,2019-02-19
"2/20/2019",240,240,237,237,239,237,225,231,232,234,240,238,237,237,237,241,241,238,238,246,260,260,241,247,251,225,250,62,128,440,463,913,225,240,2019-02-20
"2/21/2019",240,240,237,237,239,237,227,231,231,234,240,238,237,237,237,241,240,237,237,245,260,260,241,246,251,225,250,74,134,441,463,886,225,240,2019-02-21
"2/22/2019",240,240,237,237,240,237,227,232,232,234,240,238,237,237,237,241,240,237,238,245,260,255,241,246,251,225,250,77,139,442,463,894,225,240,2019-02-22
"2/25/2019",240,240,237,237,238,237,225,232,232,234,240,238,237,237,237,241,240,237,237,245,260,255,241,245,251,225,250,72,142,438,456,938,225,240,2019-02-25
"2/26/2019",240,240,237,237,238,237,225,230,232,234,240,238,237,237,237,241,240,237,237,245,260,260,241,246,251,225,250,71,141,434,452,919,225,240,2019-02-26
"2/27/2019",240,240,237,237,237,237,210,231,231,234,240,238,236,236,237,241,240,237,237,244,260,254,240,245,251,225,250,80,149,434,454,898,225,240,2019-02-27
"2/28/2019",240,240,255,255,258,237,228,230,230,235,240,238,255,255,255,241,241,258,258,264,260,260,260,275,282,225,250,75,138,445,462,1003,225,240,2019-02-28
"3/1/2019",240,240,236,236,238,234,225,231,231,235,239,238,236,236,236,241,240,237,237,245,260,255,241,246,252,225,250,93,154,449,468,1007,225,240,2019-03-01
"3/4/2019",240,240,236,236,238,237,229,231,231,234,239,238,236,236,236,241,240,237,237,245,260,255,241,245,251,225,250,87,156,449,463,965,225,240,2019-03-04
"3/5/2019",240,240,236,236,238,237,229,230,230,233,239,238,236,236,236,241,240,236,236,244,260,255,240,245,251,225,250,88,152,450,467,956,225,240,2019-03-05
"3/6/2019",240,240,236,236,238,237,227,230,230,233,239,238,235,235,236,240,240,236,236,244,255,254,240,245,250,225,250,83,148,453,469,977,225,240,2019-03-06
"3/7/2019",240,240,237,237,238,237,228,232,232,234,240,238,237,237,237,241,240,237,237,246,260,255,241,246,252,225,250,79,141,456,470,972,225,240,2019-03-07
"3/8/2019",240,240,236,236,239,235,225,230,230,234,240,238,236,236,236,241,240,236,236,244,254,252,240,245,251,225,250,81,142,454,468,954,225,240,2019-03-08
"3/11/2019",240,240,236,236,238,237,229,232,233,235,240,238,236,236,236,240,240,236,236,245,255,252,241,245,251,225,250,79,144,446,470,949,225,240,2019-03-11
"3/12/2019",240,240,237,237,239,237,228,232,232,235,240,238,237,237,237,240,240,237,237,246,254,252,241,248,252,225,250,75,143,448,471,916,225,240,2019-03-12
"3/13/2019",240,240,238,238,240,237,227,230,230,233,240,238,238,238,238,240,240,238,238,246,255,252,242,248,253,225,250,74,144,441,459,925,225,240,2019-03-13
"3/14/2019",240,240,239,239,242,237,228,234,234,236,240,238,238,238,239,240,240,239,239,247,260,254,242,248,253,225,250,78,141,427,448,879,225,240,2019-03-14
"3/15/2019",240,240,243,243,246,237,227,238,238,240,240,238,243,243,243,241,241,243,243,252,260,254,246,254,259,225,250,69,124,434,456,940,225,240,2019-03-15
"3/18/2019",240,240,238,238,241,234,228,233,233,235,240,238,238,238,238,241,240,238,238,247,260,255,243,248,253,225,250,63,121,431,450,942,225,240,2019-03-18
"3/19/2019",240,240,240,240,242,237,217,235,235,238,240,239,240,240,240,241,241,240,241,250,260,255,248,256,258,225,250,61,109,427,448,945,225,240,2019-03-19
"3/20/2019",241,240,246,246,247,235,226,233,233,240,240,239,245,245,246,241,241,246,246,254,260,255,249,257,261,225,250,73,124,422,438,928,225,240,2019-03-20
"3/21/2019",241,240,242,243,244,237,225,235,235,239,240,239,242,242,242,241,241,243,243,251,260,255,247,251,259,225,250,69,115,419,435,921,225,240,2019-03-21
"3/22/2019",241,240,238,238,240,237,228,233,233,235,240,238,238,238,238,241,241,238,238,246,260,255,242,246,252,225,250,70,123,404,418,889,225,240,2019-03-22
"3/25/2019",240,240,237,237,240,237,225,231,231,235,240,238,237,237,237,241,241,237,237,245,260,255,241,246,251,225,250,78,129,399,426,919,225,240,2019-03-25
"3/26/2019",240,240,237,237,240,237,225,232,232,235,240,239,237,237,237,241,241,237,238,246,255,255,243,250,252,225,250,76,124,393,410,901,225,240,2019-03-26
"3/27/2019",241,240,238,238,240,237,217,232,232,234,240,239,238,238,238,241,241,238,238,246,260,253,243,247,253,225,250,72,121,388,405,879,225,240,2019-03-27
